context,question,answer,source_url,category,title,org
。其中，定向医学生按照协议连续服务满6年，且每年考核均达到合格及以上等次的，方可获得第6年发放的补助经费。（三）履约保障。1.诚信记录。定向医学生就读院校、规范化培训基地及定向就业区市县卫生计生行政部门须分别如实填写《农村订单定向免费医学生诚信记录表》，加盖印章后存入定向医学生个人档案。2.违约处理。免费医学生不能如期毕业或毕业前发生违约行为的，要按规定退还已享受的各项减免和补助费用，由培养学校负责代收。毕业后发生违约行为的，要按规定退还已享受的减免和补助费用，并缴纳相当于已享受费用总额50%的违约金，由签约单位负责代收。代收费用由执收单位缴入市、县级财政金库,"定向医学生需要满足哪些条件才能获得第6年发放的补助经费？
",定向医学生需要按照协议连续服务满6年，且每年考核均达到合格及以上等次，才能获得第6年发放的补助经费。,https://www.guang-an.gov.cn/gasrmzfw/c104243/pc/content/content_1743986774211997696.html,卫生、体育,广安市人民政府办公室关于印发广安市农村订单定向医学生免费培养方案的通知,广安市人民政府办公室
。广安市人民政府办公室2017年7月19日广安市农村订单定向医学生免费培养方案为加快培养广安市“本土化”农村基层卫生专业技术人才，提升基层医疗卫生服务能力和水平，根据教育部等6部门《关于进一步做好农村订单定向医学生免费培养工作的意见》（教高〔2015〕6号）、《四川省人民政府关于加强卫生计生队伍建设的意见》（川府发〔2014〕47号）、《广安市人民政府关于加快卫生计生人才队伍建设的意见》（广府发〔2016〕2号）、省卫生计生委等5部门《关于做好2017届农村订单定向免费医学生毕业就业等有关工作的通知》（川卫发〔2017〕94号）精神，结合我市实际，制定本方案,"广安市农村订单定向医学生免费培养方案的目的是什么？
",广安市农村订单定向医学生免费培养方案的目的是加快培养广安市“本土化”农村基层卫生专业技术人才，提升基层医疗卫生服务能力和水平。,https://www.guang-an.gov.cn/gasrmzfw/c104243/pc/content/content_1743986774211997696.html,卫生、体育,广安市人民政府办公室关于印发广安市农村订单定向医学生免费培养方案的通知,广安市人民政府办公室
。一、培养目标根据各区市县乡镇医疗卫生机构人员编制空缺情况和专业人才需求，计划从2017年开始，用5年时间，通过农村订单定向医学生免费培养，解决我市基层农村卫生人才“引进难、留住难”问题，筑牢基层医疗卫生网底，为农村群众提供基本医疗卫生服务。2017年，计划订单定向免费培养农村医学生70名（其中：临床医学20名、全科医学20名、影像技术10名、检验技术10名、康复治疗技术10名）。以后每年根据基层实际需求确定培养专业和人数。二、培养方式依托广安职业技术学院为我市农村医疗卫生机构免费培养订单定向医学生，学制3年，大专学历,"我市计划如何解决基层农村卫生人才问题？
",我市计划通过农村订单定向医学生免费培养，用5年时间，根据各区市县乡镇医疗卫生机构人员编制空缺情况和专业人才需求，解决我市基层农村卫生人才“引进难、留住难”问题。,https://www.guang-an.gov.cn/gasrmzfw/c104243/pc/content/content_1743986774211997696.html,卫生、体育,广安市人民政府办公室关于印发广安市农村订单定向医学生免费培养方案的通知,广安市人民政府办公室
。3.定向医学生就业后，均应按规定参加医学规范化培训，并取得相应的培训合格证书，培训时间计入6年服务期内。培训期间的人员管理、待遇、经费保障等按有关规定执行。定向医学生申请专升本和攻读研究生须经区市县卫生计生行政部门和用人单位同意并签订协议，攻读本科和研究生期间不计入6年服务期。若规范化培训与读书时间重叠，其重叠期则按规范化培训相关规定执行。4.定向医学生在服务期内，应取得相应专业的执业资格。执业证书注册地点限乡镇卫生院和村卫生室，未经当地卫生计生行政部门同意不得变更执业地点，不得改变服务单位,"定向医学生就业后需要多长时间的医学规范化培训？
",定向医学生就业后需要进行医学规范化培训，培训时间计入6年服务期内。,https://www.guang-an.gov.cn/gasrmzfw/c104243/pc/content/content_1743986774211997696.html,卫生、体育,广安市人民政府办公室关于印发广安市农村订单定向医学生免费培养方案的通知,广安市人民政府办公室
广安市人民政府办公室关于印发广安市农村订单定向医学生免费培养方案的通知,"广安市人民政府办公室发布了什么通知？
",广安市人民政府办公室发布了广安市农村订单定向医学生免费培养方案的通知。,https://www.guang-an.gov.cn/gasrmzfw/c104243/pc/content/content_1743986774211997696.html,卫生、体育,广安市人民政府办公室关于印发广安市农村订单定向医学生免费培养方案的通知,广安市人民政府办公室
。（二）填报志愿及签订协议。对参加普通高等学校年度招生考试，并承诺毕业后到区市县定向的农村医疗卫生机构服务6年以上的考生，均须与定向就业所在区市县卫生计生部门签订《广安市免费培养定向医学生就业协议书》（一式三份），经本人及其家长（或监护人）签字，区市县卫生计生部门盖章生效（协议分别由区市县卫生计生部门、本人各保存一份，另一份存入考生档案）。（三）招生录取。订单定向培养计划作为定向就业计划纳入广安职业技术学院和其他委托培养院校（以下简称：培养院校）医学专业年度招生计划，在专科提前批次录取。定向医学生面向全省招生，主要以广安籍生源为主，在符合投档要求的考生范围内，优先录取定岗单位所在区市县生源,"定向医学生需要与哪个部门签订就业协议？
",定向医学生需要与定向就业所在区市县的卫生计生部门签订《广安市免费培养定向医学生就业协议书》。,https://www.guang-an.gov.cn/gasrmzfw/c104243/pc/content/content_1743986774211997696.html,卫生、体育,广安市人民政府办公室关于印发广安市农村订单定向医学生免费培养方案的通知,广安市人民政府办公室
。对招聘后6年内取得执业资格的定向医学生，可继续聘用到签约单位工作；在签约单位工作满6年后仍未取得执业资格者，解除聘用合同，并终止与签约单位的人事关系。四、保障措施（一）组织保障。定向医学生免费培养工作政策性强，涉及面广，市县两级卫生计生、编制、财政、人力资源社会保障、教育体育等部门和培养院校、农村医疗卫生单位要各负其责，切实落实各项政策措施，建立综合协调机制，确保工作顺利实施。（二）经费保障。1.培养补助,"定向医学生取得执业资格的时间要求是什么？
",定向医学生招聘后6年内需要取得执业资格。,https://www.guang-an.gov.cn/gasrmzfw/c104243/pc/content/content_1743986774211997696.html,卫生、体育,广安市人民政府办公室关于印发广安市农村订单定向医学生免费培养方案的通知,广安市人民政府办公室
各区市县人民政府，广安经开区、枣山园区、协兴园区、华蓥山景区管委会，市级相关部门：《广安市农村订单定向医学生免费培养方案》已经市政府同意，现印发给你们，请认真组织实施,"《广安市农村订单定向医学生免费培养方案》由谁同意印发？
",《广安市农村订单定向医学生免费培养方案》已经市政府同意印发。,https://www.guang-an.gov.cn/gasrmzfw/c104243/pc/content/content_1743986774211997696.html,卫生、体育,广安市人民政府办公室关于印发广安市农村订单定向医学生免费培养方案的通知,广安市人民政府办公室
。4.市财政局负责项目经费保障与监督。5.市教育体育局负责在市内各学校宣传定向医学生培养项目，引导本地学生填报志愿。（二）广安职业技术学院负责将每年度的定向医学生培养计划纳入高校招生计划；负责农村订单定向医学生的学校教育、培养及管理工作。（三）区市县相关部门。1.区市县卫生计生部门为本区域内项目实施的牵头单位，负责与编制、财政、人力资源社会保障部门汇总审核上报农村订单定向医学生年度需求计划，负责项目的具体组织实施和效果评估分析。2.区市县机构编制部门负责审核、预留农村订单定向医学生所需空缺编制，负责农村订单定向医学生毕业后入编事宜,"市财政局负责哪些任务？
",市财政局负责项目经费保障与监督。,https://www.guang-an.gov.cn/gasrmzfw/c104243/pc/content/content_1743986774211997696.html,卫生、体育,广安市人民政府办公室关于印发广安市农村订单定向医学生免费培养方案的通知,广安市人民政府办公室
。（二）经费保障。1.培养补助。对定向医学生在校学习期间的学费、住宿费、生活费给予一定补助，所需资金由市财政根据报备的项目管理定向医学生人数，按照每人每学年8000元的标准拨付给培养院校，培养院校按年度足额发放到学业成绩合格的定向医学生本人账户。培养院校还应对在校定向医学生提供优惠政策，对学业成绩和表现优异的，在助学金和奖学金方面予以倾斜。2.履约补助。对纳入项目管理的定向医学生，区市县财政按照每人1万元的标准，在定向医学生毕业到岗后6年内分2次补助到定向医学生人头，第1年、第6年分别按照补助金额的20％和80％发放,"定向医学生在校学习期间可以获得哪些补助？
",定向医学生在校学习期间可以获得学费、住宿费、生活费的补助。,https://www.guang-an.gov.cn/gasrmzfw/c104243/pc/content/content_1743986774211997696.html,卫生、体育,广安市人民政府办公室关于印发广安市农村订单定向医学生免费培养方案的通知,广安市人民政府办公室
。市卫生计生委会同培养院校按计划完成定向培养的招录任务。培养院校在招生录取工作结束后，将最终招录的定向医学生名单送市卫生计生委和市财政局。（四）院校培养。培养院校要按照委托培养协议要求，优化教学课程，保障教学质量，确保定向医学生毕业后具备医学基础知识、专业知识和实践技能，并能熟练运用。市卫生计生委要履行监督职能，确定专业培养质量要求，对定向医学生实行动态管理和跟踪培养，定期收集定向医学生在校表现情况，对培养院校承担定向医学生的培养工作进行全面评估，确保定向医学生修完规定学分达到毕业要求。定向医学生实习工作由市卫生计生委与培养院校共同协商安排。（五）使用管理,"定向医学生的培养工作由哪些机构共同协商安排？
",定向医学生的实习工作由市卫生计生委与培养院校共同协商安排。,https://www.guang-an.gov.cn/gasrmzfw/c104243/pc/content/content_1743986774211997696.html,卫生、体育,广安市人民政府办公室关于印发广安市农村订单定向医学生免费培养方案的通知,广安市人民政府办公室
。（五）使用管理。1.定向医学生毕业后，个人档案由培养院校负责寄往定向的区市县卫生计生部门。定向医学生按照签署的定向就业协议，在取得毕业证书后15个工作日内，凭毕业证到区市县卫生计生部门报到，由区市县卫生计生行政部门会同当地人力资源社会保障部门采取直接考核招聘的方式，纳入事业编制管理。农村医疗卫生单位应向定向医学生提供服务岗位，及时与定向医学生签订聘用合同，按相关规定办理养老、医疗等各项社会保险，并同步将报到聘用情况报市卫生计生委、市人力资源社会保障局和各区市县财政局审核备案。2.定向医学生在签约单位的最低服务期限为6年，服务期内只能在本区市县区域内农村基层医疗卫生机构之间流动,"定向医学生毕业后多长时间内需要到区市县卫生计生部门报到？
",定向医学生需要在取得毕业证书后15个工作日内到区市县卫生计生部门报到。,https://www.guang-an.gov.cn/gasrmzfw/c104243/pc/content/content_1743986774211997696.html,卫生、体育,广安市人民政府办公室关于印发广安市农村订单定向医学生免费培养方案的通知,广安市人民政府办公室
。广安职业技术学院尚未开设的专业，由广安职业技术学院委托省内其它职业或医学院校培养。三、组织实施农村订单定向医学生（以下简称“定向医学生”）免费培养工作由市卫生计生委、广安职业技术学院会同市县两级相关部门组织实施。（一）计划申报。区市县卫生计生部门根据基层医疗卫生机构人员编制空缺情况确定年度定向单位和岗位数，会同财政、人力资源社会保障、编制部门研究提出本区市县基层农村卫生人才定向培养需求计划，经区市县政府审批后，于每年12月底前报市卫生计生委统筹制定下一年度定向培养工作计划。（二）填报志愿及签订协议,"广安职业技术学院未开设的专业由谁培养？
",广安职业技术学院委托省内其他职业或医学院校培养未开设的专业。,https://www.guang-an.gov.cn/gasrmzfw/c104243/pc/content/content_1743986774211997696.html,卫生、体育,广安市人民政府办公室关于印发广安市农村订单定向医学生免费培养方案的通知,广安市人民政府办公室
