context,question,answer,source_url,category,title,org
广安市人民政府关于调整全市最低工资标准的通知,"广安市最近一次调整最低工资标准是什么时候？
",广安市最近一次调整最低工资标准的具体时间未在提供的上下文中说明。,https://www.guang-an.gov.cn/gasrmzfw/c104243/pc/content/content_1733373932666359808.html,劳动、人事、监察,广安市人民政府关于调整全市最低工资标准的通知,广安市人民政府办公室
。以上标准包含个人应缴纳的社会保险费和住房公积金。但不包括下列各项：加班加点工资；中班、夜班、高温、低温、井下、有毒有害等特殊工作条件或者特殊工作环境下的津贴；法律、法规、规章、政策规定的非工资性劳动保险福利待遇；用人单位支付给劳动者的非货币性补贴。用人单位有条件为劳动者提供食宿的，在此支出之外支付给劳动者的工资也不能低于当地最低工资标准。各县（市、区）、广安经开区和川渝高竹新区人力资源社会保障部门要加强劳动保障监察执法，确保最低工资标准落到实处，切实维护劳动者的合法权益。本通知自2022年8月1日起施行，有效期3年。2022年4月1日至本通知施行之日期间的最低工资标准，按照本通知执行,"什么是不得低于当地最低工资标准的项目？
",不得低于当地最低工资标准的项目包括加班加点工资；中班、夜班、高温、低温、井下、有毒有害等特殊工作条件或者特殊工作环境下的津贴；法律、法规、规章、政策规定的非工资性劳动保险福利待遇；用人单位支付给劳动者的非货币性补贴。,https://www.guang-an.gov.cn/gasrmzfw/c104243/pc/content/content_1733373932666359808.html,劳动、人事、监察,广安市人民政府关于调整全市最低工资标准的通知,广安市人民政府办公室
。2018年9月13日发布的《广安市人民政府关于调整全市最低工资标准的通知》（广安府函〔2018〕99号）同时废止。广安市人民政府2022年7月29日相关附件：广安府规〔2022〕5号关于调整全市最低工资标准的通知.pdf(/gasrmzfw/c104243/1733373932666359808/HItkfMYy.pdf)二维码开始扫一扫在手机打开当前页用来校验该浏览器是否支持HTML5,"广安市在2022年调整最低工资标准的文件是什么？
",广安市在2022年调整最低工资标准的文件是《广安府规〔2022〕5号关于调整全市最低工资标准的通知》。,https://www.guang-an.gov.cn/gasrmzfw/c104243/pc/content/content_1733373932666359808.html,劳动、人事、监察,广安市人民政府关于调整全市最低工资标准的通知,广安市人民政府办公室
