context,question,answer,source_url,category,title,org,groundedness_score,groundedness_eval,relevance_score,relevance_eval,standalone_score,standalone_eval
。上一级人民政府认为确有必要的，可以提级组织调查处理有关火灾事故。第六条　火灾事故发生地与发生单位不在同一个县级以上行政区域的，事故发生地人民政府组织调查处理时，应当邀请事故发生单位所在地人民政府派员参加。第七条　参加火灾事故调查处理的部门（单位）应当依照本细则的规定，严格履行职责、秉公用权，及时、准确完成调查任务，并接受监察机关的监督。火灾事故发生地人民政府应当支持、配合上级人民政府和有关部门（单位）的火灾事故调查处理工作，并提供必要的便利条件,"火灾事故调查处理的原则是什么？
",火灾事故调查处理的原则是依照本细则的规定，严格履行职责、秉公用权，及时、准确完成调查任务，并接受监察机关的监督。,https://www.guang-an.gov.cn/gasrmzfw/c104243/pc/content/content_1748932043029323776.html,公安、安全、司法,广安市人民政府办公室关于印发《广安市火灾事故调查处理实施细则》的通知,广安市人民政府办公室,4.0,上下文中提供了关于火灾事故调查处理的具体措施，如不同级别人民政府的合作、跨区域调查处理、部门职责、调查的及时性和准确性、监督、支持与配合等。这些措施体现了调查处理的原则。,5.0,这个问题对于普通公民理解其在火灾事故调查处理中的权利和应该遵循的程序非常有用。了解调查处理的原则有助于公民在火灾事故发生后正确行动，包括保护自己的权益，以及协助官方进行有效的调查工作。此外，这也有助于增强公众的安全意识，促进社会和谐稳定。,5.0,这个问题询问的是关于火灾事故调查处理的原则，这是一个广泛认可的标准程序，并不依赖于特定的上下文或文件。这个问题本身具有意义，并且可以独立于其他信息被理解和回答。
广安市人民政府办公室关于印发《广安市火灾事故调查处理实施细则》的通知,"广安市人民政府办公室发布了什么文件？
",广安市人民政府办公室发布了《广安市火灾事故调查处理实施细则》的通知。,https://www.guang-an.gov.cn/gasrmzfw/c104243/pc/content/content_1748932043029323776.html,公安、安全、司法,广安市人民政府办公室关于印发《广安市火灾事故调查处理实施细则》的通知,广安市人民政府办公室,5.0,根据提供的上下文内容，问题直接询问了广安市人民政府办公室发布的文件。上下文中明确提到了该办公室发布的文件名称为《广安市火灾事故调查处理实施细则》。因此，根据上下文信息，可以清楚、明确地回答出广安市人民政府办公室发布的文件。,,,,
。第四十条　评估组应当对火灾事故发生单位、相关单位落实防范和整改措施的情况进行监督检查，并邀请监察机关对有关处理处置、追责问责意见落实情况进行监督检查。第四十一条　评估组应当在成立之日起60日内向本级人民政府提交评估报告。第四十二条　评估组就不履行职责导致防范和整改措施落实不到位的下级人民政府、部门（单位）、基层组织和个人情况向负责火灾事故调查处理的人民政府报告,"评估组在火灾事故中应当如何行动？
",评估组应当对火灾事故发生单位、相关单位落实防范和整改措施的情况进行监督检查，并邀请监察机关对有关处理处置、追责问责意见落实情况进行监督检查。,https://www.guang-an.gov.cn/gasrmzfw/c104243/pc/content/content_1748932043029323776.html,公安、安全、司法,广安市人民政府办公室关于印发《广安市火灾事故调查处理实施细则》的通知,广安市人民政府办公室,4.0,根据上下文中的第四十条、第四十一条和第四十二条，提供了明确的指导原则和时间限制，说明评估组在火灾事故中应当如何行动。这些条款规定了评估组的监督检查职责、报告提交的时间限制以及对不履行职责的行为的报告义务。,5.0,这个问题对于普通公民来说非常有用，因为它涉及到在紧急情况下的正确行动，这些行动可能对个人安全至关重要。了解评估组在火灾事故中应该如何行动，可以帮助普通公民在类似情况下做出更明智的决定，增加自我保护能力。此外，它还有助于提高公众的安全意识和对火灾事故应急响应的理解。,2.0,这个问题是关于特定情境下的行动指南，它依赖于一些背景信息，比如火灾事故的具体情况、评估组的角色和职责等。没有这些信息，回答这个问题就缺乏足够的上下文。
