context,question,answer,source_url,category,title,org,groundedness_score,groundedness_eval,relevance_score,relevance_eval,standalone_score,standalone_eval
。探索实施学区制管理，支持建设城乡学校共同体，推动形成“以城带乡、以强带弱、城乡一体”的辐射式学区，实现学区内学校协同发展和教师统筹调配使用。认真落实《义务教育学校管理标准》，到2023年实现学校办学管理全面达标。打造一批“乡村温馨校园”，全面强化农村学校育人功能。持续做好控辍保学工作，进一步完善家庭经济困难学生资助体系，做到“应免尽免、应补尽补、应助尽助、应贷尽贷”。加大投入力度，加强特殊教育学校和资源教室建设，不断提高残疾儿童少年入学率。（责任单位：市教育体育局，市发展改革委、市财政局、市住房城乡建设局、市残联）推进普通高中多样化特色发展,"What is the goal of implementing zone-based management in schools?
","The goal of implementing zone-based management in schools is to promote the formation of a radiating school district system, achieve collaborative development among schools within the district, and facilitate the coordinated use of teachers through the system. This is done by supporting the construction of urban-rural school communities, and encouraging the ""urban leading rural, strong leading weak, urban-rural integration"" model. Additionally, it aims to ensure that all schools meet the comprehensive standards set by the ""Compulsory Education School Management Standards"" by 2023. The plan also involves creating a number of ""cozy rural school campuses"" to strengthen the educational function of rural schools. Furthermore, efforts to control school dropout rates continue, and the financial aid system for students from families with economic difficulties is further improved to ensure that support is provided to all who need it. Lastly, the plan emphasizes increasing investment to strengthen the construction of special education schools and resource classrooms, thereby continuously improving the enrollment rate of children with disabilities. (Responsible units: Municipal Education and Sports Bureau, Municipal Development and Reform Commission, Municipal Finance Bureau, Municipal Housing Urban Construction Bureau, Municipal Disability Federation)",https://www.guang-an.gov.cn/gasrmzfw/c104243/pc/content/content_1743957032687546368.html,科技、教育,广安市人民政府办公室关于印发广安市新时代深化改革推进基础教育高质量发展实施方案的通知,广安市人民政府办公室,,,,,,
。实施学校美育提升行动，着力聚焦艺术浸润、文化传承、人文厚植。上好音乐、美术、书法等课程，广泛开展校园艺术活动，使每名学生至少掌握1项艺术技能。深化书法进校园活动，支持学校组建特色艺术社团、艺术兴趣小组、艺术俱乐部，以书法、戏曲、剪纸、篆刻等中华优秀传统文化艺术为重点，开展丰富多彩的美育实践活动，定期举办市、县、校学生艺术节及艺术展演，形成本地本校的特色和传统。遴选美育类示范学校，发挥示范引领作用。整合资源，开办艺术学校。支持艺术院校在中小学建立对口支援基地，培育艺术拔尖后备人才。（责任单位：市教育体育局，市委宣传部、市文化广电旅游局、团市委、市文联）加强劳动教育," what are the specific measures mentioned in the text to improve school art education?
"," The specific measures mentioned in the text to improve school art education include focusing on artistic education, cultural inheritance, and humanistic cultivation, teaching music, art, calligraphy, and other courses, carrying out campus art activities, ensuring that each student masters at least one artistic skill, deepening the activity of calligraphy entering campus, supporting schools in establishing characteristic art clubs and interest groups, focusing on traditional Chinese excellent cultural arts such as calligraphy, drama, paper cutting, and seal cutting, carrying out rich and colorful art education practices, regularly holding city, county, and school student art festivals and art performances, forming local and school characteristics and traditions, selecting model schools for art education, playing a leading role in demonstration, integrating resources to open art schools, supporting art colleges in establishing supporting bases in primary and secondary schools, and cultivating artistic reserve talents.",https://www.guang-an.gov.cn/gasrmzfw/c104243/pc/content/content_1743957032687546368.html,科技、教育,广安市人民政府办公室关于印发广安市新时代深化改革推进基础教育高质量发展实施方案的通知,广安市人民政府办公室,4.0,从上下文中可以明确提取出具体的措施，如实施美育提升行动、上特定课程、开展艺术活动、深化书法活动、组建艺术社团、举办艺术节和艺术展演、遴选示范学校、开办艺术学校和建立支援基地等。这些措施都是为了提高学校艺术教育的质量和影响。,4.0,这个问题询问了文本中提到的具体措施，用以改善学校艺术教育。这对于普通公民理解政府如何具体实施教育政策，以及这些政策如何影响他们孩子的教育质量是非常有用的。具体措施的明了有助于公民评估政策的可行性和影响，从而使他们能够更好地参与到相关公共事务的讨论和决策中去。,1.0,问题直接询问文本中提到的改善学校艺术教育的具体措施。由于没有提供文本内容，我无法确定问题中的“specific measures”是指哪些措施。没有上下文信息，这个问题无法得到有意义或准确的回答。
。坚持立德树人。坚持全员全程全方位育人，构建以社会主义核心价值观为引领，中小幼一体，学校家庭社会协调的德育体系。大力弘扬新时代爱国主义精神，利用“四史”、重大历史事件纪念活动、中华民族传统节庆、国家公祭仪式等，教育引导学生感党恩、听党话、跟党走，扎根人民、奉献国家。发挥课程育人功能，强化学科德育，抓实课程思政、少先队活动课程，注重主题教育、仪式教育。打造社会实践大课堂，向学生免费或优惠开放爱国主义、优秀传统文化等各类教育基地、公共文化设施与自然资源,"如何坚持立德树人？
",通过构建以社会主义核心价值观为引领，实现中小幼一体，学校家庭社会协调的德育体系。,https://www.guang-an.gov.cn/gasrmzfw/c104243/pc/content/content_1743957032687546368.html,科技、教育,广安市人民政府办公室关于印发广安市新时代深化改革推进基础教育高质量发展实施方案的通知,广安市人民政府办公室,5.0,这个问题是根据上下文内容提出的，上下文详细描述了坚持立德树人具体做法，包括构建德育体系、弘扬爱国主义精神、发挥课程育人功能、打造社会实践大课堂等。因此，根据上下文，我们可以清楚明确地回答这个问题。,5.0,这个问题涉及到教育的核心目标和方针，对于普通公民理解教育政策文件以及如何在日常生活中支持和促进社会主义核心价值观的培养非常有用。立德树人是中国教育的根本任务，关系到国家未来的发展和社会文化的建设。因此，这个问题有助于提高公民对教育政策重要性的认识，激励人们参与到立德树人的实践中去。,5.0,这个问题是一个典型的教育领域的问题，涉及到教育的根本任务和目标，是一个具有普遍意义的问题。立德树人是一个抽象的概念，但它是教育的根本任务和目标，因此这个问题是独立于特定上下文的，具有普遍的意义。
