context,question,answer,source_url,category,title,org,groundedness_score,groundedness_eval,relevance_score,relevance_eval,standalone_score,standalone_eval
。每年按规定组织婴幼儿照护服务机构从业人员参加卫生保健培训和健康检查，预防控制传染病，降低常见病的发病率，保障婴幼儿身心健康。（牵头单位：各区市县政府及园区管委会、市卫生健康委；责任单位：市属相关医疗卫生单位）4.加强婴幼儿照护服务机构制度建设及安全监管。各类婴幼儿照护服务机构要建立完善的消防安全、卫生安全、食品安全、医疗安全、设备安全、保卫安全、职业健康安全等内部制度，强化责任约束，建立安全隐患排查机制，做好各种突发安全事故的应急预案，定期开展演练，提高对各类安全事故的防范和控制能力,"每年婴幼儿照护服务机构从业人员需要参加哪些培训和检查？
",每年婴幼儿照护服务机构从业人员需要参加卫生保健培训和健康检查。,https://www.guang-an.gov.cn/gasrmzfw/c104243/pc/content/content_1733382721805225984.html,人口和计划生育、妇女儿童工作,广安市人民政府办公室关于促进3岁以下婴幼儿照护服务发展的实施意见,广安市人民政府办公室,4,根据上下文内容，问题得到了明确的回答。上下文中提到了从业人员需要参加的培训和检查内容，以及制度建设和安全监管的要求，这些都是对问题的直接回答。,5.0,这个问题对于普通公民了解婴幼儿照护服务机构从业人员的培训和检查要求非常有用。这有助于家长和社会了解服务机构的专业性和可靠性，从而保障婴幼儿的照护质量。同时，这也促进了服务机构从业人员的专业成长和职业素养。,2.0,这个问题询问的是关于婴幼儿照护服务机构从业人员的培训和检查要求，这些信息通常会受到特定国家或地区法规和政策的约束。没有上下文信息，很难给出一个普适的答案，因为这取决于具体的工作环境、相关立法以及执行标准。
。（二）加强部门协作。婴幼儿照护服务发展工作由卫生健康部门牵头，发展改革、教育、公安、民政、财政、人力资源社会保障、自然资源、住房城乡建设、应急、税务、市场监管等部门（单位）要按照各自职责，细化婴幼儿照护服务政策措施，强化协作配合，加强工作指导、监督和管理。充分发挥工会、共青团、妇联、计划生育协会等群团组织和行业组织作用，形成工作合力，推动婴幼儿照护服务的健康发展。（三）加强示范引领。加大宣传力度，开展婴幼儿照护服务示范活动，建设具有带动效应、承担一定指导功能的示范性婴幼儿服务机构，充分发挥示范引领、带动辐射作用，不断提高婴幼儿照护服务整体水平,"婴幼儿照护服务发展工作由哪些部门牵头？
",婴幼儿照护服务发展工作由卫生健康部门牵头。,https://www.guang-an.gov.cn/gasrmzfw/c104243/pc/content/content_1733382721805225984.html,人口和计划生育、妇女儿童工作,广安市人民政府办公室关于促进3岁以下婴幼儿照护服务发展的实施意见,广安市人民政府办公室,5,根据上下文，“（二）加强部门协作”部分明确指出“婴幼儿照护服务发展工作由卫生健康部门牵头”，因此，可以根据上下文清楚、明确地回答该问题。,,,,
。（牵头单位：各区市县政府及园区管委会、市卫生健康委；责任单位：市发展改革委、市教育体育局、市民政局、市市场监管局、市经济信息化局、市国资委、市总工会）4.加强城乡婴幼儿照护服务设施建设。各地要统筹规划建设婴幼儿照护服务机构，充分考虑城镇化进程，根据人口空间聚集态势，在新建居住区按照每千人口不少于10个托位规划、建设婴幼儿照护服务设施及配套安全设施，并与住宅同步验收、同步交付使用；老城区和已建成居住区无婴幼儿照护服务设施的，要限期通过购置、置换、租赁等方式按照每千人口不少于8个托位建设婴幼儿照护服务设施。在农村社区综合服务设施建设中，统筹考虑婴幼儿照护服务设施建设,"在各区市县政府及园区管委会、市卫生健康委中，哪些单位是牵头单位和责任单位？
",牵头单位是各区市县政府及园区管委会、市卫生健康委；责任单位包括市发展改革委、市教育体育局、市民政局、市市场监管局、市经济信息化局、市国资委、市总工会。,https://www.guang-an.gov.cn/gasrmzfw/c104243/pc/content/content_1733382721805225984.html,人口和计划生育、妇女儿童工作,广安市人民政府办公室关于促进3岁以下婴幼儿照护服务发展的实施意见,广安市人民政府办公室,5,上下文中明确指出了牵头单位和责任单位的信息，即各区市县政府及园区管委会、市卫生健康委是牵头单位，市发展改革委、市教育体育局、市民政局、市市场监管局、市经济信息化局、市国资委、市总工会是责任单位。因此，该问题可以根据上下文清楚、明确地回答。,4.0,这个问题对于普通公民理解政策文件非常有用。它涉及到哪些单位在政策执行中扮演关键角色，这有助于公民了解政策实施的层次结构和责任分配，进而能够更清晰地把握政策落实的情况，以及知道在遇到困难时可以向哪些单位寻求帮助或进行反馈。,2.0,该问题涉及特定的组织架构和职责分配，对于不熟悉当地政府组织结构的人来说，可能需要额外的信息才能理解哪些单位是牵头单位和责任单位。
。（牵头单位：各区市县政府及园区管委会、市卫生健康委、市发展改革委；责任单位：市财政局、市民政局、市住房城乡建设局、市市场监管局）3.发展形式多样的婴幼儿照护服务机构。支持各地开展家庭邻里式婴幼儿照护服务试点。鼓励支持规模较大的医院、学校或青年职工较集中的企业在单位内部设置机构，为单位职工提供福利性婴幼儿照护服务，有条件的可向附近居民开放。积极推进托育和幼儿教育相衔接的托幼服务一体化建设，支持有条件的幼儿园在满足适龄幼儿入园需求的前提下，充分利用现有资源开设托幼班，招收2至3岁以下的婴幼儿。各类婴幼儿照护服务机构可根据家庭的实际需求，提供全日托、半日托、计时托、临时托等多样化的婴幼儿照护服务,"什么是家庭邻里式婴幼儿照护服务试点？
",家庭邻里式婴幼儿照护服务试点是指在社区中，通过邻里之间的互助合作，为婴幼儿提供照护服务的一种模式。这种服务试点通常由社区牵头，动员邻里中的家长或专业人士共同参与，形成一个照护婴幼儿的网络，提供灵活多样的婴幼儿照护选项，以满足不同家庭的需求。,https://www.guang-an.gov.cn/gasrmzfw/c104243/pc/content/content_1733382721805225984.html,人口和计划生育、妇女儿童工作,广安市人民政府办公室关于促进3岁以下婴幼儿照护服务发展的实施意见,广安市人民政府办公室,4,上下文提供了家庭邻里式婴幼儿照护服务试点的目标、实施主体、服务对象、服务形式等关键信息。虽然上下文没有提供一个完整的定义，但通过描述这种服务的实施方式和服务内容，可以清楚理解其大致概念和目的。因此，问题可以在给定上下文的情况下得到明确回答。,4.0,这个问题涉及到婴幼儿照护服务的具体试点项目，这对于普通公民了解政府如何实施相关政策，以及这些政策如何影响他们自己和家庭日常生活非常重要。一个家庭是否选择参与这样的试点项目，可能会根据他们对服务的理解程度。因此，了解家庭邻里式婴幼儿照护服务试点的具体内容和目的，对于公民来说是很有用的。,1.0,这个问题涉及到一个特定的政策试点项目，即家庭邻里式婴幼儿照护服务试点，这个项目不是广泛为人所知的，可能需要额外的信息来解释其目的、实施背景和具体内容。因此，该问题对上下文有较强的依赖性。
。鼓励有条件的妇幼保健机构、妇女儿童医院、社区卫生服务中心等，依法通过“公建民营”“公办民营”等方式，新建、改建、扩建、联建一批具有婴幼儿照护服务行业培训、家庭养育指导和家长课堂等多功能的示范性婴幼儿照护服务指导中心，发挥辐射带动作用，推动实现婴幼儿照护服务机构管理专业化、服务优质化、运营规范化。（牵头单位：各区市县政府及园区管委会、市卫生健康委；责任单位：市发展改革委、市自然资源规划局、市民政局、市财政局、市住房城乡建设局、市总工会、市妇联）2.支持社会力量兴办普惠性婴幼儿照护服务机构,"哪些机构被鼓励通过“公建民营”“公办民营”等方式新建、改建、扩建、联建示范性婴幼儿照护服务指导中心？
",妇幼保健机构、妇女儿童医院、社区卫生服务中心被鼓励通过“公建民营”“公办民营”等方式新建、改建、扩建、联建示范性婴幼儿照护服务指导中心。,https://www.guang-an.gov.cn/gasrmzfw/c104243/pc/content/content_1733382721805225984.html,人口和计划生育、妇女儿童工作,广安市人民政府办公室关于促进3岁以下婴幼儿照护服务发展的实施意见,广安市人民政府办公室,5,根据上下文内容，明确指出了哪些机构（妇幼保健机构、妇女儿童医院、社区卫生服务中心）被鼓励通过一定的方式（“公建民营”“公办民营”）进行新建、改建、扩建、联建示范性婴幼儿照护服务指导中心。问题得到了明确和具体的回答。,4.0,这个问题对于希望了解国家在婴幼儿照护服务领域具体政策执行细节的公民来说，非常有用。它涉及到政策的具体实施机构，这些信息对于关心公共项目如何执行和希望参与相关项目的人是重要的。此外，对于研究人员、政策分析师以及对此类服务有需求的家长来说，了解哪些机构被鼓励参与建设示范性婴幼儿照护服务指导中心，可以帮助他们更准确地获取相关服务和资源。,3.0,这个问题涉及到特定的政策和管理问题，它需要对当前的相关政策有所了解才能回答。没有提供足够的背景信息来判断是哪些机构被鼓励进行上述活动。
广安市人民政府办公室关于促进3岁以下婴幼儿照护服务发展的实施意见,"广安市人民政府办公室提出了什么实施意见？
",广安市人民政府办公室提出了关于促进3岁以下婴幼儿照护服务发展的实施意见。,https://www.guang-an.gov.cn/gasrmzfw/c104243/pc/content/content_1733382721805225984.html,人口和计划生育、妇女儿童工作,广安市人民政府办公室关于促进3岁以下婴幼儿照护服务发展的实施意见,广安市人民政府办公室,5,根据上下文内容，问题直接询问了广安市人民政府办公室提出的实施意见是什么。上下文已经明确提供了答案，即广安市人民政府办公室提出了关于促进3岁以下婴幼儿照护服务发展的实施意见。因此，这个问题可以清楚、明确地回答。,,,,
。依法实行婴幼儿照护服务机构工作人员职业资格准入制度。对在婴幼儿照护服务机构就业的专业技术人员，执行与医疗卫生机构、教育机构相同的职称评审政策。在婴幼儿照护服务机构开发公益性岗位，按规定落实岗位补贴和社保补贴。（牵头单位：各区市县政府及园区管委会、市教育体育局、市卫生健康委；责任单位：市财政局、市人力资源社会保障局、市卫生健康委、广安职业技术学院）（四）推进信息化建设。充分利用互联网、大数据、物联网、人工智能等技术，推动建设婴幼儿照护服务信息平台，结合婴幼儿照护服务实际，为群众提供科学育儿服务,"婴幼儿照护服务机构工作人员是否需要职业资格准入？
",是的，婴幼儿照护服务机构工作人员需要依法实行职业资格准入制度。,https://www.guang-an.gov.cn/gasrmzfw/c104243/pc/content/content_1733382721805225984.html,人口和计划生育、妇女儿童工作,广安市人民政府办公室关于促进3岁以下婴幼儿照护服务发展的实施意见,广安市人民政府办公室,5,根据提供的上下文内容，明确提到了“依法实行婴幼儿照护服务机构工作人员职业资格准入制度”，这表明在这些机构工作的工作人员必须具备相应的职业资格。此外，还提到了对这类工作人员的职称评审政策，以及提到的相关部门，进一步说明了职业资格准入的存在和重要性。,,,,
。婴幼儿托育服务机构的新建、改建、扩建必须严格执行《托儿所、幼儿园建筑设计规范》（2019版）、《建筑设计防火规范》（GB50016—2014）（2018年版）和抗震规定及其他相关规定。（牵头单位：各区市县政府及园区管委会、市卫生健康委；责任单位：市发展改革委、市住房城乡建设局、市民政局、市市场监管局、市公安局、市人力资源社会保障局、市应急局、市消防救援支队）3.加强婴幼儿照护服务机构卫生保健。贯彻落实保育为主、保教结合的工作方针，各级妇幼保健机构、疾病预防控制机构、基层医疗卫生机构、卫生监督机构按照职责，加强对婴幼儿照护服务机构卫生保健工作的业务指导、咨询服务和监督检查,"新建、改建、扩建婴幼儿托育服务机构必须遵守哪些规范？
",新建、改建、扩建婴幼儿托育服务机构必须严格执行《托儿所、幼儿园建筑设计规范》（2019版）、《建筑设计防火规范》（GB50016—2014）（2018年版）和抗震规定及其他相关规定。,https://www.guang-an.gov.cn/gasrmzfw/c104243/pc/content/content_1733382721805225984.html,人口和计划生育、妇女儿童工作,广安市人民政府办公室关于促进3岁以下婴幼儿照护服务发展的实施意见,广安市人民政府办公室,5,根据上下文内容，问题询问的是婴幼儿托育服务机构在新建、改建、扩建时必须遵守的规范。上下文中明确提到了相关的法规和规范，即《托儿所、幼儿园建筑设计规范》（2019版）、《建筑设计防火规范》（GB50016—2014）（2018年版）和抗震规定及其他相关规定。这些信息提供了具体的遵守指南，说明是可以明确回答该问题的。,5.0,这个问题对于普通公民来说非常有用，因为它涉及到婴幼儿托育服务机构的建设和管理规范，这些规范直接关系到婴幼儿的安全和福祉。了解这些规范可以帮助公民在选择托育服务时做出更明智的决策，同时也能促进服务质量的提高和行业标准的建立。此外，对于那些打算开设婴幼儿托育服务机构的人来说，这个问题也非常关键，因为他们需要确保自己的业务符合所有相关规范。,5.0,这个问题询问的是婴幼儿托育服务机构必须遵守的规范，这些规范属于婴幼儿托育服务领域的专门规定，不依赖任何特定上下文或额外信息即可理解。因此，问题本身具有独立性。
。按照儿童早期发展科学育儿有关规范要求，完善家庭科学育儿指导服务网络建设，鼓励各级妇幼保健机构争创省级儿童早期发展教育示范基地的同时，创建各级示范性儿童早期发展科学育儿指导中心（站），由各级妇幼保健机构牵头建立科学育儿指导团队，通过入户指导、亲子活动、家长课堂等方式，普及科学育儿知识，提高家庭科学育儿能力。鼓励社区开展科学育儿活动。（牵头单位：各区市县政府及园区管委会、市卫生健康委；责任单位：市教育体育局、市总工会、市妇联、团市委）3.加强婴幼儿健康管理,"什么是提高家庭科学育儿能力的一种方式？
",提高家庭科学育儿能力的一种方式是建立科学育儿指导团队，并通过入户指导、亲子活动、家长课堂等方式普及科学育儿知识。,https://www.guang-an.gov.cn/gasrmzfw/c104243/pc/content/content_1733382721805225984.html,人口和计划生育、妇女儿童工作,广安市人民政府办公室关于促进3岁以下婴幼儿照护服务发展的实施意见,广安市人民政府办公室,5,上下文提供了具体的措施，如完善家庭科学育儿指导服务网络建设，创建示范性儿童早期发展科学育儿指导中心，由妇幼保健机构牵头建立科学育儿指导团队等，这些方式可以直接提高家庭科学育儿能力。因此，问题可以在给定上下文的情况下得到明确回答。,5.0,这个问题对于普通公民理解政策文件非常有用，因为它关注的是提升家庭科学育儿的能力，这是一个直接关系到家庭质量和儿童成长的重要议题。了解政府或相关机构提供的科学育儿方法、资源或指导可以帮助家庭更好地养育孩子，这符合国家促进家庭幸福和社会稳定的政策目标。,5.0,该问题是一个普遍性的询问，提供了足够的信息，使得大多数人都能理解其含义。虽然具体实施可能需要更多的上下文信息，但问题本身是独立且有意义的。
。（责任单位：各区市县政府及园区管委会、市卫生健康委）（二）加快推进婴幼儿照护服务机构和设施建设。1.加快建设婴幼儿照护服务指导中心。依托妇幼保健机构、社区卫生服务中心（站）、社区活动中心等各类服务设施和资源，建立婴幼儿照护服务指导中心，并将婴幼儿照护服务延伸到乡镇（街道），有条件的地方延伸到村（社区），逐步建立县（市、区）、乡镇（街道）、村（社区）三级婴幼儿照护服务网络,"婴幼儿照护服务指导中心的建设依托哪些机构？
",婴幼儿照护服务指导中心的建设依托于妇幼保健机构、社区卫生服务中心（站）、社区活动中心等。,https://www.guang-an.gov.cn/gasrmzfw/c104243/pc/content/content_1733382721805225984.html,人口和计划生育、妇女儿童工作,广安市人民政府办公室关于促进3岁以下婴幼儿照护服务发展的实施意见,广安市人民政府办公室,5,根据上下文内容，婴幼儿照护服务指导中心的建设是依托于妇幼保健机构、社区卫生服务中心（站）、社区活动中心等机构和服务资源。这些机构和服务资源将共同建立婴幼儿照护服务指导中心，并将其服务延伸到乡镇（街道）以及有条件的地方延伸到村（社区），逐步建立县（市、区）、乡镇（街道）、村（社区）三级婴幼儿照护服务网络。因此，该问题能在给定上下文中清楚、明确地回答。,,,,
各区市县人民政府，广安经开区、枣山园区、协兴园区、华蓥山景区管委会，市级相关部门：为深入贯彻落实《国务院办公厅关于促进3岁以下婴幼儿照护服务发展的指导意见》（国办发〔2019〕15号）和《四川省人民政府办公厅关于促进3岁以下婴幼儿照护服务发展的实施意见》（川办发〔2020〕1号）精神，进一步促进3岁以下婴幼儿（以下简称婴幼儿）健康成长，满足人民群众对婴幼儿照护服务需求，全面助推我市“两孩政策”实施，经市政府同意，现提出如下实施意见,"《国务院办公厅关于促进3岁以下婴幼儿照护服务发展的指导意见》的文号是什么？
",国办发〔2019〕15号,https://www.guang-an.gov.cn/gasrmzfw/c104243/pc/content/content_1733382721805225984.html,人口和计划生育、妇女儿童工作,广安市人民政府办公室关于促进3岁以下婴幼儿照护服务发展的实施意见,广安市人民政府办公室,5,根据提供的上下文内容，明确提到了《国务院办公厅关于促进3岁以下婴幼儿照护服务发展的指导意见》的文号为“国办发〔2019〕15号”。这个信息是直接给出的，因此可以根据上下文清楚、明确地回答问题。,5.0,这个问题对于需要精确查找特定政策文件的普通公民来说非常有用。文号是识别和引用政策文件的关键信息，对于研究人员、政策实施者或者任何需要准确引用该文件的公民来说都是必要的。因此，这个问题有助于提高公民对政策文件的了解和应用能力。,3.0,这个问题是询问特定文件的文号，文号是文件的一个唯一标识，通常在文件的第一页或者标题页可以找到。该问题不依赖于特定的上下文，只要提供了该文件名，任何熟悉该文件的人应该都能回答出文号。
。广安市人民政府办公室2020年9月10日相关附件：二维码开始扫一扫在手机打开当前页用来校验该浏览器是否支持HTML5,"广安市人民政府办公室在什么时候发布了相关附件？
",广安市人民政府办公室在2020年9月10日发布了相关附件。,https://www.guang-an.gov.cn/gasrmzfw/c104243/pc/content/content_1733382721805225984.html,人口和计划生育、妇女儿童工作,广安市人民政府办公室关于促进3岁以下婴幼儿照护服务发展的实施意见,广安市人民政府办公室,5,上下文中明确提到了广安市人民政府办公室发布相关附件的具体日期，即“2020年9月10日”，这是一个确切的日期，提供了清晰的时间信息。因此，可以根据上下文清楚、明确地回答问题。,3.0,这个问题对于普通公民理解政策文件的有用性是中等的。知道广安市人民政府办公室发布相关附件的具体时间可能会对某些人很有用，比如研究人员、政策分析师或者需要追溯某个政策历史的人。对于普通公民来说，这个信息可能不是迫切需要的，因为它并不直接影响到政策的内容或执行，除非该时间点对于理解政策文件的生效时间有直接影响。,1.0,这个问题涉及到特定政府机构在特定时间发布附件的具体信息，这些信息并不是普遍知识的一部分，因此需要特定的上下文才能理解。
。各级妇幼保健机构、疾病预防控制机构、基层医疗卫生机构要切实做好基本公共卫生服务和妇幼保健工作，推进优生优育全程服务，加强出生缺陷综合防治，提高出生人口素质。为婴幼儿家庭开展宣传教育、新生儿访视、儿童中医药健康管理、新生儿疾病筛查、膳食营养、生长发育、预防接种、安全防护、疾病防控等服务。保障免疫规划疫苗供应，提升预防接种管理质量。树立婴儿健康家长“第一责任人”意识，培养科学喂养行为习惯，提高母乳喂养率。建立和完善婴幼儿健康服务信息平台，实现婴幼儿健康的动态管理，推进婴幼儿健康管理进家庭、进社区、进托育机构,"（各级妇幼保健机构需要提供哪些服务来提高出生人口素质？）
",（各级妇幼保健机构需要提供基本公共卫生服务、妇幼保健工作、宣传教育、新生儿访视、儿童中医药健康管理、新生儿疾病筛查、膳食营养、生长发育、预防接种、安全防护、疾病防控等服务来提高出生人口素质。）,https://www.guang-an.gov.cn/gasrmzfw/c104243/pc/content/content_1733382721805225984.html,人口和计划生育、妇女儿童工作,广安市人民政府办公室关于促进3岁以下婴幼儿照护服务发展的实施意见,广安市人民政府办公室,5,根据上下文内容，问题中询问的妇幼保健机构需要提供的服务在上下文中都有明确的描述，包括宣传教育、新生儿访视、儿童中医药健康管理、新生儿疾病筛查等多个方面。因此，根据上下文，这个问题可以清楚、明确地回答。,4.0,这个问题对于普通公民理解妇幼保健机构的服务内容和目标非常有用。了解这些服务可以帮助公民评估妇幼保健机构的工作质量，并更好地理解如何通过这些服务提高出生人口素质。此外，这也有助于公民为自己和家庭做出更明智的健康决策。,5.0,这个问题询问的是妇幼保健机构需要提供哪些服务来提高出生人口素质，这是一个具有普遍性的问题，不依赖于特定的上下文或信息。这个问题本身有意义，并且可以独立地进行回答。
