context,question,answer,source_url,category,title,org,groundedness_score,groundedness_eval,relevance_score,relevance_eval,standalone_score,standalone_eval
。三是扩展职业发展前景。本科及以上学历毕业、经全科专业住院医师规范化培训合格并到基层医疗卫生机构工作的，可直接参加中级职称考试，考试通过的直接聘任中级职称；经全科专业住院医师规范化培训和全科专业专科医师规范化培训合格的全科医生，在基层医疗卫生机构的中高级专业技术岗位聘用中，符合条件者优先评聘；全科诊所的设置不受医疗机构相关规划布局的限制，由市场自主调节，支持符合条件的全科医生个体或合伙在城乡开办全科诊所,"什么是全科专业住院医师规范化培训？
",全科专业住院医师规范化培训是指对本科及以上学历毕业生，在经过一段时间的临床实践后，进行的一种系统化、规范化的培训，使其具备全科医生的基本技能和素质，能够独立从事基层医疗卫生工作。,https://www.guang-an.gov.cn/gasrmzfw/c104243/pc/content/content_1743902946286022656.html,卫生、体育,广安市人民政府办公室关于改革完善全科医生培养与使用激励机制的实施意见,广安市人民政府办公室,4,根据上下文，问题得到了较为详细的回答。上下文中提到了全科专业住院医师规范化培训的目的、优点以及对全科医生职业发展的影响，这说明问题是可以被明确回答的。,4.0,全科专业住院医师规范化培训是一个专门针对全科医生的培训项目，目的是为了提高他们的业务水平和服务能力。这对于普通公民来说，有助于了解国家对于基层医疗人才的培养政策，以及这一政策对于提高基层医疗服务质量的作用。同时，了解全科专业住院医师规范化培训的内容，可以帮助公民更好地理解全科医生的专业背景和能力，从而增强对基层医疗服务的信任。,3.0,这个问题询问了一个专业性较强的概念，即全科专业住院医师规范化培训。这个术语在没有上下文的情况下较难理解，因为它涉及到特定的医学专业领域，以及国家或地区特定的医学教育政策和实践标准。因此，该问题的理解明显依赖于对医学教育和培训体系的了解。
。到2020年，基层医疗卫生机构90%以上的在职在岗执业（助理）医师接受全科医生转岗培训。实行乡村医生全员全科基本知识技能培训，并有计划地安排乡村医生到乡镇卫生院、社区卫生服务中心、县级医疗卫生机构进修学习。三、改革完善全科医生使用激励机制（六）改革完善全科医生薪酬制度。以体现包括全科医生在内的医务人员技术劳务价值为导向，推进医疗服务价格改革，并与医保政策相衔接,"基层医疗卫生机构到2020年有多少在职在岗执业（助理）医师接受了全科医生转岗培训？
",到2020年，基层医疗卫生机构90%以上的在职在岗执业（助理）医师接受了全科医生转岗培训。,https://www.guang-an.gov.cn/gasrmzfw/c104243/pc/content/content_1743902946286022656.html,卫生、体育,广安市人民政府办公室关于改革完善全科医生培养与使用激励机制的实施意见,广安市人民政府办公室,5,上下文提供了具体的数据（90%以上），说明了对在职在岗执业（助理）医师接受全科医生转岗培训的情况。这使得对该问题的回答具有明确性和准确性。,4.0,这个问题涉及到基层医疗卫生机构在职在岗执业（助理）医师接受全科医生转岗培训的具体数据，这对于普通公民理解国家对于基层医疗人才培养和提升服务质量的政策执行情况非常有用。这样的数据可以帮助公民评估政策效果，了解政府如何推动医疗资源的均衡分布和医疗服务能力的提升。因此，这个问题对于普通公民来说具有较高的实用价值。,2.0,这个问题是具体的，并且涉及特定的数据（在职在岗执业医师的数量和全科医生转岗培训的情况），这个数据与时间点（2020年）相关。没有上下文信息，这个问题很难回答。因此，它依赖于特定的统计数据和时间点，应该被评级为依赖上下文信息的程度较高。
。加快推进“人才池”“岗编适度分离”等人才管理模式改革，对经住院医师规范化培训合格到农村基层执业的全科医生，可实行“县管乡用”（县级医疗卫生机构聘用管理、乡镇卫生院使用）；对经助理全科医生培训合格到村卫生室工作的助理全科医生，可实行“乡管村用”（乡镇卫生院聘用管理、村卫生室使用）。（八）拓展全科医生职业发展前景。增加基层医疗卫生机构的中高级专业技术岗位比例，重点向经全科专业住院医师规范化培训和全科专业专科医师规范化培训合格的全科医生倾斜，符合条件者优先评聘。单位未设置相应等级岗位或者设置的相应等级岗位无空缺的，可按规定设置专业技术特设岗位，不受单位岗位总量、最高等级和结构比例限制,"什么是“县管乡用”模式？
",“县管乡用”模式是指县级医疗卫生机构聘用管理经过住院医师规范化培训合格到农村基层执业的全科医生，而乡镇卫生院使用这些医生的一种人才管理模式。,https://www.guang-an.gov.cn/gasrmzfw/c104243/pc/content/content_1743902946286022656.html,卫生、体育,广安市人民政府办公室关于改革完善全科医生培养与使用激励机制的实施意见,广安市人民政府办公室,5,根据提供的上下文，问题得到了清晰的回答。上下文解释了“县管乡用”是什么，以及它是如何运作的，包括县级机构与乡镇卫生院的角色和责任。因此，该问题在给定上下文下可以被清楚和明确地回答。,4.0,“县管乡用”模式是指在地方政府管理和财政分配中的一种模式，其中县级政府负责管理和分配乡镇级政府的财政资源。这种模式对于普通公民理解他们所在地区的政府运作和财政来源非常有用。它涉及到地方政府的管理结构和资源分配，这些都是普通公民在参与社会管理和公共事务时需要了解的基本知识。此外，了解这种模式还有助于公民监督政府行为，确保财政资金的合理使用。,3.0,这个问题询问了一个特定的政策或管理模式“县管乡用”，这个模式可能并不是广泛认知的，它可能依赖于特定的地理、政治或行政上下文来得到准确解释。没有额外的上下文信息，回答这个问题的清晰度和准确性可能会受到影响。
