context,question,answer,source_url,category,title,org,groundedness_score,groundedness_eval,relevance_score,relevance_eval,standalone_score,standalone_eval
。相关单位根据本地和相关行业信用体系建设需要，制定本区域行业信用建设规章制度，明确信用信息记录主体的责任，保证信用信息的客观、真实、准确，完善信用信息共享公开制度，推动信用信息资源的有序开发利用。〔市级相关部门（单位）牵头、各区市县政府、园区管委会负责〕四、全面推进政务诚信、商务诚信、社会诚信和司法公信建设（十五）推进政务信用信息公开。在保护国家信息安全、商业秘密和个人隐私前提下，依法公开行政管理过程中的信用信息。深入开展全市各部门行政许可和行政处罚等信用信息公示工作。〔市政务服务中心、人行广安市中心支行牵头，市级相关部门（单位）负责〕（十六）建立政府守信践诺机制,"本地和相关行业信用体系建设需要哪些措施？
",根据上下文，本地和相关行业信用体系建设需要制定规章制度，明确信用信息记录主体的责任，保证信用信息的客观、真实、准确，完善信用信息共享公开制度，推动信用信息资源的有序开发利用。,https://www.guang-an.gov.cn/gasrmzfw/c104243/pc/content/content_1733359136558551040.html,市场监管、安全生产监管,广安市人民政府办公室关于印发广安市社会信用体系建设工作实施方案的通知,广安市人民政府办公室,,,,,,
。按照“条块结合、属地服务、互联互通、全市共享”原则，依法开展统一平台建设和全市公共信用信息的归集、披露、使用及其他相关工作，推进并逐步实现全市公共信用信息与社会各领域非涉密信用信息交换共享。全市统一的社会信用信息平台设计和提供多种标准数据接口，实现市内各部门各区域相关平台系统联接共享。〔市发展改革委、人行广安市中心支行牵头，市级相关部门（单位）配合〕（八）建设开通统一对外服务窗口“信用广安”网站。信用广安网作为市级公共信用基础数据（公共信用信息）统一对外发布、接受外部查询和异议受理等的平台，为企业、个人和社会征信机构等查询信用信息提供便利，为社会提供优质高效的信用信息服务,"什么是“信用广安”网站的主要功能？
",“信用广安”网站是市级公共信用基础数据统一对外发布、接受外部查询和异议受理的平台，为企业、个人和社会征信机构等查询信用信息提供便利，并为社会提供优质高效的信用信息服务。,https://www.guang-an.gov.cn/gasrmzfw/c104243/pc/content/content_1733359136558551040.html,市场监管、安全生产监管,广安市人民政府办公室关于印发广安市社会信用体系建设工作实施方案的通知,广安市人民政府办公室,5.0,根据上下文内容，清楚明确地描述了“信用广安”网站的主要功能。上下文提到了网站是信用信息发布的平台，提供查询和异议受理服务，并且指出了服务的对象，即企业、个人和社会征信机构。这表明问题可以被清楚和具体地回答。,4.0,了解“信用广安”网站的主要功能对于普通公民来说非常有用，因为这样的信息可以帮助他们更好地理解政府提供的服务，同时也能让他们知道如何正确地使用这些服务。这个网站可能包含了关于社会信用体系的信息，这对于公民了解个人信用的重要性以及如何维护个人信用记录非常关键。此外，了解这个网站的功能也有助于公民在需要时能够有效地获取相关服务或信息。,2.0,问题直接询问“信用广安”网站的主要功能，并没有提供足够的背景信息来确定这个网站是什么，或者它所属的上下文。因此，要回答这个问题，需要额外的信息来了解网站的性质和目的。
。加快农村信用信息服务网和融资对接平台建设，完善农户、农村专业合作社、休闲农业和农产品生产、加工企业等农村社会成员信用信息跨部门采集标准和方式，依法依规记录和整合农村社会成员的信用信息，建立健全农村社会成员信用档案；开展信用户、信用村、信用乡镇创建评定活动，深入推进青年信用示范户评定，推进新型农村经营主体等农业产业化组织信用建设；重点围绕金融服务、公共服务、社会安全、食品安全等领域，加强农村社会成员信用等级评定结果的应用，对信用等级较高的农村社会成员，在授信额度、利率、项目资金安排、补贴补助、审批手续办理等方面给予优惠和方便，引导关注自身信用状况；建立健全农民信用联保制度，推进和发展农业保险，,"为什么要加快农村信用信息服务网和融资对接平台的建设？
",为了完善农户、农村专业合作社、休闲农业和农产品生产、加工企业等农村社会成员信用信息的跨部门采集标准和方式，依法依规记录和整合农村社会成员的信用信息，建立健全农村社会成员信用档案。,https://www.guang-an.gov.cn/gasrmzfw/c104243/pc/content/content_1733359136558551040.html,市场监管、安全生产监管,广安市人民政府办公室关于印发广安市社会信用体系建设工作实施方案的通知,广安市人民政府办公室,5.0,上下文中提到了多个目的，包括1) 完善信用信息跨部门采集标准和方式，2) 建立健全农村社会成员信用档案，3) 推动信用体系建设，4) 提升金融服务效率，5) 促进农村经济发展和社会稳定。这些目的都明确指出了加快农村信用信息服务网和融资对接平台建设的原因和重要性。,,,,
。组织相关人员开展培训。充分利用电视、广播、报纸等传统媒体和网络、微信等新媒体，深入开展“诚信兴商宣传月”“信用记录关爱日”“国际消费者权益保护日”“诚信活动周”等公益活动，普及诚信文化和征信文化，提高全民信用意识。〔市委宣传部、市文明办牵头，各区市县政府、园区管委会、市级相关部门（单位）负责〕（四十一）深入开展学校诚信宣传教育。支持、鼓励学校开设信用理论课程，积极开展信用理论学术研究。建立学校诚信宣传教育联络员制度，使诚信宣传教育与助学贷款政策同步。开展“校园诚信行动计划”，采用适合幼儿园和大中小学学生认知水平和喜闻乐见的形式，宣传基础信用知识,"什么组织负责普及诚信文化和征信文化？
",市委宣传部、市文明办牵头，各区市县政府、园区管委会、市级相关部门（单位）负责。,https://www.guang-an.gov.cn/gasrmzfw/c104243/pc/content/content_1733359136558551040.html,市场监管、安全生产监管,广安市人民政府办公室关于印发广安市社会信用体系建设工作实施方案的通知,广安市人民政府办公室,4.0,根据上下文，明确提到了市委宣传部、市文明办牵头，以及其他政府机构和相关部门负责普及诚信文化和征信文化。这表明在给定的上下文中，确实可以清楚、明确地回答出负责普及这些文化的组织。,4.0,这个问题对于普通公民理解政策文件非常有用，因为它询问的是具体负责推广诚信文化和征信文化的组织，这些文化对于个人在社会中的经济行为和信用体系至关重要。了解这样的组织对于公民来说可以帮助他们更好地理解整个社会的信用体系是如何运作的，以及如何维护自己的信用记录。此外，这也有助于提高公众对于诚信的重视程度，从而促进一个更加健康和有序的经济环境。,3.0,这个问题询问的是特定的组织机构，这些组织机构的职责可能不是广泛为人所知。没有上下文信息，普通人可能不确切知道哪个组织负责普及诚信文化和征信文化。因此，这个问题依赖于特定的知识背景和信息才能得到确切的答案。
。按照四川省制定的信用主体和信用档案的标识标准、信用信息的数据格式和代码标准、数据接口标准以及信息安全、应用支撑技术和基础设施等相关标准，完善我市的企业和个人信用评价指标、评价标准、评估规程及信用报告的内容和格式。〔市发展改革委、人行广安市中心支行牵头，市级相关部门（单位）配合〕（十三）推行行政管理部门绩效考核。明确我市社会信用体系建设主要责任指标考核办法，落实我市各部门社会信用体系建设相关工作职责，对守信激励失信惩戒、按时推送报送信用信息、示范应用信用信息等情况，建立政府部门绩效考核机制。〔市发展改革委、人行广安市中心支行牵头，相关部门（单位）配合〕（十四）推进部门（行业）和地方信用制度建设,"何标准用于完善我市的企业和个人信用评价指标、评价标准、评估规程及信用报告的内容和格式？
",按照四川省制定的信用主体和信用档案的标识标准、信用信息的数据格式和代码标准、数据接口标准以及信息安全、应用支撑技术和基础设施等相关标准。,https://www.guang-an.gov.cn/gasrmzfw/c104243/pc/content/content_1733359136558551040.html,市场监管、安全生产监管,广安市人民政府办公室关于印发广安市社会信用体系建设工作实施方案的通知,广安市人民政府办公室,5.0,该问题的答案在上下文中直接提及，清晰明了。上下文提供了具体的实施标准和相关部门的职责分工，说明了如何完善信用评价指标等内容。因此，该问题可以根据上下文清楚、明确地回答。,3.0,这个问题对于普通公民来说有一定难度，因为它涉及到具体的政策和技术细节。然而，它对于那些从事企业运营、金融服务业或者对个人信用体系有兴趣的公民来说，是非常有用的。了解这些标准可以帮助他们更好地理解信用评价体系的运作方式，从而可能对他们的商业决策或个人财务管理产生积极影响。此外，对于希望参与或影响本地信用体系建设的社会成员，这个问题也是非常有价值的。然而，对于大多数普通公民来说，这个问题可能太过具体和专业，因此实用性有限。,3.0,这个问题询问的是关于特定城市的企业和个人信用评价标准的完善方法，这些信息可能受到当地政策、法规和经济环境的直接影响。问题本身是具体的，并且涉及一定的上下文信息，如“我市”的企业和个人信用评价体系。然而，由于问题提出的方式是通用性的，它也具有一定的独立性，因为探讨如何完善信用评价指标、评价标准、评估规程及信用报告的内容和格式是一个广泛讨论的主题，不仅仅局限于某个特定城市。
。〔市发展改革委、人行广安市中心支行牵头，各区市县政府、园区管委会、市级相关部门（单位）负责〕（三十二）创新价格诚信建设。在药品零售、民营医院、民用水电气安装的价格和收费领域，从遵守价格行为规则以及价格欺诈、价格垄断、违反公平竞争政策等方面建立和完善价格诚信记录，利用全市社会信用信息交换共享机制，抄告卫生、药品招标、医保、食品药品监管、工商、建设、质监、税务、银行等部门（单位），强化对定价主体价格行为的约束和奖惩，提升价格诚信创建水平。〔市发展改革委牵头，市级相关部门（单位）负责〕（三十三）进行小微企业信用体系试点,"药品零售领域如何进行价格诚信建设？
",在药品零售领域，通过建立和完善价格诚信记录，以及遵守价格行为规则，来创新价格诚信建设。同时，对价格欺诈、价格垄断、违反公平竞争政策等行为进行监管。,https://www.guang-an.gov.cn/gasrmzfw/c104243/pc/content/content_1733359136558551040.html,市场监管、安全生产监管,广安市人民政府办公室关于印发广安市社会信用体系建设工作实施方案的通知,广安市人民政府办公室,4.0,根据上下文，提供了药品零售领域进行价格诚信建设的方法和措施，如遵守价格行为规则、建立和完善价格诚信记录等。这些方法都是基于上下文中提到的相关部门和单位的责任和任务，因此可以根据上下文清楚、明确地回答该问题。,5.0,药品零售领域的价格诚信建设是维护市场秩序、保护消费者权益的重要方面。这个问题对于普通公民理解相关政策文件非常有用，因为它直接关系到公民的切身利益，比如能够帮助公民了解如何避免购买到高价药品，如何辨别价格诚信的零售商等。同时，这个问题也涉及到政策执行的监督和参与，有助于提高公民的政策意识和市场参与度。,4.0,这个问题询问的是药品零售领域的一个具体问题，它涉及对当前商业实践和管理政策的理解。虽然这个问题可能受益于特定国家或地区的背景信息，但它主要关注的是一个较为普遍的商业议题，因此具有独立性。
运输局、市商务局、市司法局、市安全监管局、市文广新局、市卫生计生委、市食品药品监管局、市投资促进委、市旅游发展委、市统计局、市工商局、市质监局、市政务服务中心、市政府金融办、市政府法制办、市公共资源交易中心、市国税局、市地税局、人行广安市中心支行、广安银监分局、市保险行业协会联席会议下设办公室于市发展改革委，由市发展改革委主要负责人任主任，人行广安市中心支行和市工商局主要负责人任副主任，负责统筹开展联席会议的日常工作,"市发展改革委的主要职责是什么？
",市发展改革委的主要职责是负责统筹开展联席会议的日常工作。,https://www.guang-an.gov.cn/gasrmzfw/c104243/pc/content/content_1733359136558551040.html,市场监管、安全生产监管,广安市人民政府办公室关于印发广安市社会信用体系建设工作实施方案的通知,广安市人民政府办公室,1.0,提供的上下文信息没有直接描述市发展改革委的主要职责。相反，它提供了与该部门相关的其他组织机构的列表。因此，无法根据上下文明确、清楚地回答市发展改革委的主要职责是什么。,5.0,了解市发展改革委的主要职责对于普通公民来说非常有用，因为这有助于公民理解政府部门的职能和运作，以及如何与这些部门互动。此外，了解这些职责有助于公民在需要时寻求相应的政府服务和帮助。,3.0,这个问题询问的是一个具体机构（市发展改革委）的主要职责，这通常与特定的上下文信息相关，比如该机构所在的市政府的组织结构、职能分工等。如果没有这些背景信息，该问题的答案可能不明确或者难以理解。
。相关附件：二维码开始扫一扫在手机打开当前页用来校验该浏览器是否支持HTML5,"二维码通常用来做什么？
",二维码通常用来在手机上打开网页、应用程序，或者用来校验浏览器是否支持HTML5等技术。,https://www.guang-an.gov.cn/gasrmzfw/c104243/pc/content/content_1733359136558551040.html,市场监管、安全生产监管,广安市人民政府办公室关于印发广安市社会信用体系建设工作实施方案的通知,广安市人民政府办公室,3.0,虽然二维码的应用非常广泛，但是给定的上下文信息只提到了它在浏览器校验HTML5支持方面的应用。因此，根据上下文，我们只能明确回答二维码在这个特定情境下的用途。,3.0,这个问题虽然简单，但对于普通公民来说，了解二维码的常见用途对于日常生活非常有用，比如在购物、支付、身份验证等方面。二维码是现代生活中信息传递和数据交换的一个重要工具，因此这个问题对于理解周围环境中的技术应用很有帮助。,5.0,二维码是一种广泛使用的编码系统，它可以存储各种类型的信息，如文本、网址、联系方式、地理位置等。在许多应用场景中，二维码被用来简化数据输入和信息获取的过程。例如，在产品包装上扫描二维码可以了解产品的详细信息；在公共场所扫描二维码可以获取地图导航服务；在智能手机应用程序中扫描二维码可以快速添加联系人或加入群组。因此，二维码的应用非常广泛，几乎涵盖了各个行业和领域。
。积极发挥行业社会组织的作用，促进行业信用建设和行业守信自律。建立重点行业从业人员信用信息档案库。加强企业诚信管理制度建设，鼓励企业建立客户档案，开展客户诚信评价。强化企业在贸易、发债、借款、担保等经济活动中诚信履约，根据企业信用状况实施信用分类监管，促进诚信自律。〔市工商局牵头，市级相关部门（单位）负责〕（二十）健全社会领域信用信息采集制度。加快社会领域信用信息采集，建立社会领域从业人员信用信息档案、制定信用评价标准。建设社会组织登记管理信息系统，将社会组织诚信建设纳入全市统一的信用信息平台系统。〔市民政局牵头，市级相关部门（单位）负责〕（二十一）加快社会层面诚信建设,"什么部门牵头负责建立社会领域信用信息采集制度？
",市民政局牵头，市级相关部门（单位）负责。,https://www.guang-an.gov.cn/gasrmzfw/c104243/pc/content/content_1733359136558551040.html,市场监管、安全生产监管,广安市人民政府办公室关于印发广安市社会信用体系建设工作实施方案的通知,广安市人民政府办公室,5.0,根据上下文内容，特别是“健全社会领域信用信息采集制度”部分，“市民政局牵头，市级相关部门（单位）负责”表明市民政局是主要负责建立社会领域信用信息采集制度的部门。,3.0,这个问题涉及到政府管理和运行的具体细节，对于普通公民来说，了解哪个部门负责建立信用信息采集制度，有助于提高透明度和问责制，促进公民与政府之间的互信。然而，对于日常生活而言，这样的信息可能不是非常直接相关。,2.0,这个问题涉及到中国政府部门的职能和特定的政策安排，这些信息对于不熟悉中国政府的组织结构的人来说可能不太清楚。因此，为了理解这个问题，需要对中国的政府架构和最近的信用信息政策有一定的了解。
。在司法领域从司法公正、司法公开、司法为民、司法廉洁等方面进行司法公信建设，不断提高司法公信力。积极推进法院公信和检察公信建设。全面推行“阳光执法”，依法及时公开执法办案的制度规范、程序时限等信息。大力推进司法行政信息公开，完善相关司法领域的信息管理和披露手段。研究建立推进执法规范化的制度措施。〔市委政法委牵头，市中级人民法院、市检察院、市公安局、市司法局负责〕（三十一）推动信用试点城市建设。制定全市社会信用体系建设城市试点工作方案，指导和鼓励支持我市信用建设基础条件较好的区市县争取成为全省社会信用体系建设示范城市,"什么是司法公信建设的主要目标？
",司法公信建设的主要目标包括提高司法公正、司法公开、司法为民、司法廉洁，以不断增强司法公信力。,https://www.guang-an.gov.cn/gasrmzfw/c104243/pc/content/content_1733359136558551040.html,市场监管、安全生产监管,广安市人民政府办公室关于印发广安市社会信用体系建设工作实施方案的通知,广安市人民政府办公室,5.0,根据提供的上下文内容，问题关于司法公信建设的主要目标已经明确回答了。上下文中提到了司法公正、司法公开、司法为民、司法廉洁等方面，以及具体的措施如“阳光执法”、信息管理和披露手段等，这些都是司法公信建设的主要目标。因此，该问题可以根据上下文清楚、明确地回答。,4.0,这个问题涉及到司法领域的目标设定，对于普通公民来说，了解司法公信建设的主要目标有助于增加对法律体系和司法公正的认识，提升法律意识，增强对司法制度的信任。同时，这也有助于公民在日常生活和遇到法律问题时，更好地理解司法行为和结果的价值导向。因此，这个问题对于普通公民理解政策文件是有帮助的。,5.0,这个问题询问的是司法公信建设的主要目标，这是一个具有普遍性和广泛性的概念，不依赖于特定的上下文或信息。它是关于司法体系的一个基本目标，是公众普遍关心的话题。因此，这个问题是独立于特定上下文的，具有普遍意义。
。研究制定广安市法人和其他组织统一社会信用代码制度建设工作实施方案，探索公民统一社会信用代码制度建设，按照相关制度标准，推动在经济社会活动中广泛使用统一社会信用代码。〔市发展改革委牵头，市级相关部门（单位）负责〕（六）归集整合信用信息。依照统一规划，各部门依托自身现有业务系统，按信用信息相应标准和推送方式进行数据交换。通过归集和整理，形成全市信用信息公共数据库。公共数据库以信用信息为主线，主要涵盖：1.企业信用信息数据库。依法依规记录和整合企业信用信息，建立完善本行业、本系统企业信用信息，并统一归集到市企业信用信息公示系统。〔市工商局牵头，市级相关部门（单位）配合〕2.个人信用信息数据库,"广安市在统一社会信用代码制度建设工作实施方案中负责哪些工作？
",广安市在统一社会信用代码制度建设工作实施方案中负责探索公民统一社会信用代码制度建设，并推动在经济社会活动中广泛使用统一社会信用代码。,https://www.guang-an.gov.cn/gasrmzfw/c104243/pc/content/content_1733359136558551040.html,市场监管、安全生产监管,广安市人民政府办公室关于印发广安市社会信用体系建设工作实施方案的通知,广安市人民政府办公室,5.0,根据上下文，广安市的主要工作包括制定实施方案、探索公民统一社会信用代码制度建设以及推动统一社会信用代码在经济社会活动中的广泛使用。这些工作内容在上下文中都有明确的描述，因此可以清楚、明确地回答问题。,5.0,该问题针对的是广安市政府在统一社会信用代码制度建设工作实施方案中的具体职责，这对于普通公民了解当地政府在这一重要制度建设中的角色和功能非常有用。普通公民可以通过这样的信息了解政府如何组织和管理社会信用体系，这不仅关系到每个人的社会活动，也体现了政府的服务职能和管理水平。因此，这个问题对于普通公民来说是非常相关的。,2.0,这个问题涉及到一个具体的地点（广安市）和一个具体的制度（统一社会信用代码制度建设工作实施方案）。没有提供关于广安市或该制度的其他背景信息，所以这个问题的答案依赖于特定的地方政策和制度安排。
。〔人行广安市中心支行牵头，各区市县政府、园区管委会、市级相关部门（单位）负责〕七、积极发展信用产业及服务市场（三十五）培育信用需求。积极引导各行业扩大信用需求、发展信用交易，扩大信用经济规模。在工程建设、政府采购、重大项目管理、招投标等重点领域，率先推行信用记录和信用报告应用工作，逐步扩大信用评级、信用报告等信用信息的使用范围，培育和形成市场诚信的产品需求。按照《企业信息公示暂行条例》规定，建立企业信用信息异常经营名录制度，完善进出机制，对被列入企业信用信息公示系统经营异常名录或者严重违法企业名单的企业依法予以限制或者禁入," Who is responsible for the development of the credit industry and the credit service market?
"," The People's Bank of Guang'an City Center leads the efforts, with the city and district governments, industrial parks, and municipal departments responsible for its development.",https://www.guang-an.gov.cn/gasrmzfw/c104243/pc/content/content_1733359136558551040.html,市场监管、安全生产监管,广安市人民政府办公室关于印发广安市社会信用体系建设工作实施方案的通知,广安市人民政府办公室,3.0,虽然上下文中提到了多个机构在积极发展信用产业及服务市场中的具体职责，但并没有指明哪个实体或者部门是直接负责整个信用行业及服务市场发展的主导力量。文中提到的职责更多地集中在信用需求的引导和信用信息的公示、使用等方面。,,,,
