context,question,answer,source_url,category,title,org,groundedness_score,groundedness_eval,relevance_score,relevance_eval,standalone_score,standalone_eval
。〔市发展改革委牵头，市级相关部门（单位）配合〕（十一）加强全过程建章立制。在征信环节，按照省上的要求梳理和发布全市公共信用信息资源目录，发布数据征集、信用主体编码等规范。在管信环节，重点加强对公共信用信息的安全管理，建立完善异议处理、投诉办理和侵权责任追究制度。在用信环节，重点推进信用服务和信用产品（信用报告和信用评级等）应用，在行政管理、社会管理、商务活动等领域广泛推行使用信用产品。〔市发展改革委、人行广安市中心支行牵头，市级相关部门（单位）配合〕（十二）加快推进标准和技术规范建设,"市级相关部门（单位）在哪些环节加强全过程建章立制？
",市级相关部门（单位）在征信环节、管信环节和用信环节加强全过程建章立制。,https://www.guang-an.gov.cn/gasrmzfw/c104243/pc/content/content_1733359136558551040.html,市场监管、安全生产监管,广安市人民政府办公室关于印发广安市社会信用体系建设工作实施方案的通知,广安市人民政府办公室,5.0,根据上下文内容，问题得到了明确的回答。上下文具体描述了市级相关部门（单位）在不同环节加强全过程建章立制的具体措施和方向。,,,,
。及时公开部门执法办案的制度规范、程序时限、办案进程等信息。建立执行案件信息公开和执行案件信息查询制度，建立行贿犯罪档案查询制度。〔市委政法委牵头，市中级人民法院、市检察院、市公安局、市司法局负责〕（二十三）推进司法执法和从业人员信息建设。归集法院、检察院、公安、司法行政等工作人员信用信息，建立司法执法人员信用档案，推进司法执法人员规范履行职责。推进律师、公证员、基层法律服务工作者、法律援助人员、司法鉴定人员等诚信规范执业。〔市委政法委牵头，市中级人民法院、市检察院、市公安局、市司法局负责〕五、全面构建守信激励和失信惩戒机制（二十四）增强对守信主体的奖励和激励。加大对守信行为的表彰和宣传力度,"什么是推进司法执法和从业人员信息建设的主要内容？
",推进司法执法和从业人员信息建设的主要内容包括归集法院、检察院、公安、司法行政等工作人员信用信息，建立司法执法人员信用档案，以及推进律师、公证员、基层法律服务工作者、法律援助人员、司法鉴定人员等诚信规范执业。,https://www.guang-an.gov.cn/gasrmzfw/c104243/pc/content/content_1733359136558551040.html,市场监管、安全生产监管,广安市人民政府办公室关于印发广安市社会信用体系建设工作实施方案的通知,广安市人民政府办公室,4.0,根据提供的上下文内容，问题得到了明确的回答。上下文中提到了推进司法执法和从业人员信息建设的具体内容，包括信息公开、信用档案建设以及守信激励和失信惩戒机制等。这些信息可以直接回答问题，因此问题的可回答性较高。,3.0,这个问题对于普通公民来说，可能比较具体和专业，因此需要一定程度的政策知识背景才能理解。然而，了解推进司法执法和从业人员信息建设的主要内容对于公民理解司法体系的现代化和透明化进程是有帮助的。这直接关系到司法公正和效率，以及从业人员的职业行为标准，是维护社会公平正义的重要方面。,3.0,这个问题询问的是一个比较宽泛的主题，需要对当前的司法体系、政策有一定的了解才能具体回答。虽然问题本身提出了一个主题，但是没有提供具体的上下文信息，比如是在讨论中国的司法体系还是其他国家的，因此回答需要依赖于对当前司法执法和从业人员信息建设的一般知识。
。工商、税务、工程建设、食品药品安全、安全生产、产品质量、价格、进出口、合同履约、环境保护、卫生计生、知识产权、流通服务、电子商务、交通运输、人力资源社会保障、教育科研等领域主管部门，要以管理服务需求为导向，在保护隐私、责任明确、数据及时准确且符合国家相关法律法规及部门规章的前提下，按照风险分散原则，建立信用信息交换共享机制，依法推进各信用信息系统的互联互通和政务信用信息的交换共享。〔市级相关部门（单位）牵头〕（五）加强统一社会信用代码制度建设,"什么是工商、税务、工程建设等领域主管部门要以管理服务需求为导向建立的东西？
",信用信息交换共享机制。,https://www.guang-an.gov.cn/gasrmzfw/c104243/pc/content/content_1733359136558551040.html,市场监管、安全生产监管,广安市人民政府办公室关于印发广安市社会信用体系建设工作实施方案的通知,广安市人民政府办公室,4.0,根据上下文内容，工商、税务、工程建设等领域主管部门要以管理服务需求为导向建立的东西是“信用信息交换共享机制”。该机制的目的是在保护隐私和符合法律法规的前提下，实现信息的互联互通和交换共享，以便于各个部门能够高效地进行管理和提供服务。这个答案直接来源于问题的提问和上下文的描述，具备明确性和针对性。,4.0,这个问题涉及到多个政府部门的职能和管理方向，对于普通公民理解政府如何根据需求提供服务和管理有较大帮助。它有助于公民了解不同部门之间的协调和合作方式，以及它们如何响应和服务于公众需求。,3.0,这个问题询问的是工商、税务、工程建设等领域主管部门根据管理服务需求所建立的事物，这个问题的内容是明确的，并且有意义，即使没有具体的上下文信息，大多数人也能够理解这些领域主管部门的职能和目的。因此，这个问题的独立性较高。
