context,question,answer,source_url,category,title,org,groundedness_score,groundedness_eval,relevance_score,relevance_eval,standalone_score,standalone_eval
广安市人民政府办公室关于促进和规范健康医疗大数据应用发展的实施意见,"广安市人民政府办公室发布了什么实施意见？
",广安市人民政府办公室发布了关于促进和规范健康医疗大数据应用发展的实施意见。,https://www.guang-an.gov.cn/gasrmzfw/c104243/pc/content/content_1743958013403901952.html,卫生、体育,广安市人民政府办公室关于促进和规范健康医疗大数据应用发展的实施意见,广安市人民政府办公室,5.0,根据上下文内容，问题得到了明确且具体的回答。上下文中提到了“广安市人民政府办公室关于促进和规范健康医疗大数据应用发展的实施意见”，这直接对应了问题中的“什么实施意见”。因此，这个问题是可以清楚、明确地回答的。,,,,
。各地、各有关部门要切实将健康医疗大数据应用发展摆在重要位置，纳入国民经济与社会发展总体规划，研究制定本地、本部门推动健康医疗大数据应用发展的具体实施意见，加强组织领导，统筹整合资源，积极构建党委政府领导、多方参与、资源共享、协同推进、齐抓共管的工作格局。（责任部门：各区市县人民政府，广安经开区、枣山园区、协兴园区、华蓥山景区管委会，市发展改革委、市经济和信息化委、市人力资源社会保障局、市卫生计生委、市中医管理局、市食品药品监管局）（二）明确工作责任。卫生计生部门要加强对全市健康医疗大数据应用发展的指导，制定落实相关规划及政策、标准和规范,"（请根据上下文提供具体的问题）
",（请根据上下文提供具体的答案）,https://www.guang-an.gov.cn/gasrmzfw/c104243/pc/content/content_1743958013403901952.html,卫生、体育,广安市人民政府办公室关于促进和规范健康医疗大数据应用发展的实施意见,广安市人民政府办公室,5.0,根据上下文内容，问题可以明确回答。文本指出各地和相关部门需要将健康医疗大数据应用发展置于重要位置，并纳入总体规划；需要加强组织领导，统筹整合资源，构建多方参与的工作格局；并且，卫生计生部门要负责制定规划和政策，以及相关标准和规范。,,,,
"lid=""data-article-sxp""></ul></div>上下篇E数字人加载中...数字人css数字人js<scripttype=""text/javascript""src=""/gasrmzfw/pc2023/js/FileSaver.js""></script><scripttype=""text/javascript""src=""/gasrmzfw/pc2023/js/jquery.wordexport.js""></script>相关信息S(javascript:;)(javascript:;)","What type of script is being sourced in the provided context?
",A JavaScript script is being sourced in the provided context.,https://www.guang-an.gov.cn/gasrmzfw/c104243/pc/content/content_1743958013403901952.html,卫生、体育,广安市人民政府办公室关于促进和规范健康医疗大数据应用发展的实施意见,广安市人民政府办公室,5.0,"从上下文中可以看出，正在引入的脚本是 JavaScript 类型的。这是通过 script 标签的 type 属性明确指定的，其中包含了 ""text/javascript""。此外，上下文中也出现了多个 JavaScript 文件路径，进一步表明了脚本类型。",2.0,这个问题询问的是在提供的上下文中正在寻找哪种类型的脚本。这个问题对于理解政策文件的内容和目的并不是直接相关的，除非政策文件中涉及到了特定类型的脚本或编程语言的使用。因此，对于普通公民来说，这个问题可能不是非常有用，除非他们正在寻找与政策文件相关的技术细节。,5.0,该问题询问的是在提供的上下文中正在使用的脚本类型。它没有明确依赖特定的先前信息或设置，并且足够具体，可以在没有额外信息的情况下理解其意义。
。各地各有关部门要认真落实省上制定的财税、价格、医保、科技、投资、创新等方面的支持政策，并结合实际制定配套支持政策，支持、促进和规范健康医疗大数据应用发展。创新多元投入机制，鼓励和引导社会资本、民间资本参与健康医疗大数据基础工程，应用开发和运营服务。鼓励政府与企事业单位、社会机构开展合作，探索通过政府采购、社会众包等方式，实现健康医疗大数据领域政府应用与社会应用相融合。（责任部门：市发展改革委、市经济和信息化委、市财政局、市人力资源社会保障局、市卫生计生委、市中医管理局、市地税局、市国税局、市政府金融办、市科技和知识产权局、人行广安市中心支行）（四）强化人才支撑,"省上制定了哪些方面的支持政策？
",省上制定了财税、价格、医保、科技、投资、创新等方面的支持政策。,https://www.guang-an.gov.cn/gasrmzfw/c104243/pc/content/content_1743958013403901952.html,卫生、体育,广安市人民政府办公室关于促进和规范健康医疗大数据应用发展的实施意见,广安市人民政府办公室,,,,,,
问：《广安市人民政府办公室关于促进和规范健康医疗大数据应用发展的实施意见》（广安府办发〔2017〕11号）文件的实施范围？ 答：广安市范围内医疗卫生机构。,"《广安市人民政府办公室关于促进和规范健康医疗大数据应用发展的实施意见》的实施范围是什么？
",广安市范围内医疗卫生机构。,https://www.guang-an.gov.cn/gasrmzfw/c104243/pc/content/content_1743958013403901952.html,卫生、体育,广安市人民政府办公室关于促进和规范健康医疗大数据应用发展的实施意见,广安市人民政府办公室,5.0,根据上下文中的问答，可以直接得出《广安市人民政府办公室关于促进和规范健康医疗大数据应用发展的实施意见》的实施范围是广安市范围内的医疗卫生机构。这个答案清晰地回答了问题，并且是根据上下文中提供的信息直接得出的。,3.0,这个问题对于普通公民来说有用，因为它询问的是关于健康医疗大数据应用发展的政策实施意见的实施范围。这关系到广安市居民的健康医疗信息如何被使用和规范，与每个人的利益息息相关。然而，该问题的具体性表明它可能更适合政策制定者、医疗专业人士或对政府具体政策有兴趣的公民。对于普通居民而言，了解实施意见的总体方向和目的可能比具体实施范围更为重要。,3.0,这个问题是询问《广安市人民政府办公室关于促进和规范健康医疗大数据应用发展的实施意见》的实施范围，这是一个具体的问题，它直接指向特定的文件和政策，并且该文件的内容与广安市政府的行政范围有关。虽然这个问题是具体的，但是它仍然是独立于上下文的，因为实施范围是文件内容的一部分，不需要额外的信息就可以被理解。
。以数字化医院评审为载体，实现二级以上医疗机构信息化提档升级，完善以电子病历为核心的医院信息平台建设，提升医疗机构信息化管理水平。加快建立远程医疗应用体系，推广应用远程会诊、远程影像、远程病理、远程心电诊断服务，推进大医院与基层医疗卫生机构、全科医生与专科医生的数据资源共享和业务协同，促进优质医疗资源下沉。（责任部门：市卫生计生委、市中医管理局、市经济和信息化委）（四）加强健康医疗大数据公共卫生服务应用。整合居民健康档案和电子病历等基础信息，逐步形成全市公共卫生大数据监测网络，实现各类医疗卫生服务机构信息共享和业务联动,"数字化医院评审的目的是什么？
",数字化医院评审的目的是实现二级以上医疗机构信息化提档升级，完善以电子病历为核心的医院信息平台建设，提升医疗机构信息化管理水平。,https://www.guang-an.gov.cn/gasrmzfw/c104243/pc/content/content_1743958013403901952.html,卫生、体育,广安市人民政府办公室关于促进和规范健康医疗大数据应用发展的实施意见,广安市人民政府办公室,4.0,根据提供的上下文内容，问题得到了明确的回答。上下文详细解释了数字化医院评审的目的，包括信息化提升、电子病历核心信息平台建设、医疗机构信息化管理水平提升，以及远程医疗服务体系的建立和促进数据资源共享。,4.0,这个问题对于普通公民来说非常有用，因为它涉及到医疗服务的评审和数字化，这与每个人的健康和医疗服务质量直接相关。了解数字化医院评审的目的，可以帮助公民更好地理解他们所接受医疗服务的质量和医院运营的透明度。此外，它也涉及到政策如何在日常生活中影响公民，以及他们如何能够通过了解这些政策来参与到自己的健康管理中。,3.0,问题直接询问数字化医院评审的目的，这是一个普遍关心的话题，并且可以独立于特定上下文被理解和讨论。虽然具体实施和目的可能会因地区和政策不同而有所差异，但问题本身是关于一个普遍的概念。
。加快健康医疗数据安全体系建设，建立健全数据安全管理责任制度，规范数据采集、传输、存储、使用、开放等各环节管理，切实加强对涉及国家利益、公共安全、商业秘密、个人隐私等信息的保护。健全完善健康医疗数据安全和运维管理机制，加强各级医疗卫生机构信息安全防范。（责任部门：市卫生计生委、市中医管理局、市经济和信息化委、市公安局、市密码管理局）三、保障措施（一）加强组织领导。促进和规范健康医疗大数据应用发展，对深化医药卫生体制改革，提升健康医疗服务质量水平，不断满足人民群众多层次、多样化的健康需求，培育健康医疗新业态，促进关联产业发展具有重要意义,"建立健全数据安全管理责任制度的目的有哪些？
",建立健全数据安全管理责任制度的目的是为了规范健康医疗数据安全体系建设，保护涉及国家利益、公共安全、商业秘密、个人隐私等信息，并加强各级医疗卫生机构信息安全防范。,https://www.guang-an.gov.cn/gasrmzfw/c104243/pc/content/content_1743958013403901952.html,卫生、体育,广安市人民政府办公室关于促进和规范健康医疗大数据应用发展的实施意见,广安市人民政府办公室,4.0,根据上下文内容，上述目的被详细地阐述和解释，它们直接关联到数据安全管理责任制度的建立和实施。上下文中提到了确保各类信息得到保护、规范数据管理流程、加强信息安全防范、推动健康医疗大数据应用发展、提升服务质量以及促进产业进步等多个方面，这些目的都很明确，并且与当前我国对健康医疗数据安全管理的要求相吻合。,,,,
。财政、金融、科技和知识产权、发展改革、人力资源社会保障、经济和信息化等部门要密切配合，形成合力，推动重点任务落实。各区市县人民政府、园区管委会要重视健康医疗大数据应用发展，切实抓好基层建设，制定出台配套措施，推动全市健康医疗大数据信息产业发展。（责任部门：各区市县人民政府，广安经开区、枣山园区、协兴园区、华蓥山景区管委会，市政府金融办、市发展改革委、市财政局、市国税局、市地税局、市经济和信息化委、市人力资源社会保障局、市卫生计生委、市中医管理局、市食品药品监管局、市公安局、市文广新局、市科技和知识产权局、人行广安市中心支行）（三）加大政策支持,"哪些部门要密切配合，形成合力，推动重点任务落实？
",财政、金融、科技和知识产权、发展改革、人力资源社会保障、经济和信息化等部门要密切配合，形成合力，推动重点任务落实。,https://www.guang-an.gov.cn/gasrmzfw/c104243/pc/content/content_1743958013403901952.html,卫生、体育,广安市人民政府办公室关于促进和规范健康医疗大数据应用发展的实施意见,广安市人民政府办公室,4.0,根据上下文内容，问题中询问的部门和单位已经在文中明确列出，可以直接回答。同时，上下文中还提到了这些部门和单位需要形成合力，这也为回答问题提供了额外的信息。,4.0,这个问题对于普通公民理解政策文件非常有用。了解哪些部门需要密切配合，可以让人理解政策执行的跨部门协调机制，以及这一机制对于政策落实的重要性。此外，这也有助于公民了解他们在政策实施过程中可以期待哪些部门的合作与支持。,5.0,这个问题询问了哪些部门需要配合以推动重点任务落实，它并没有提供任何具体的上下文信息，如这些部门属于哪个组织或任务的具体内容。因此，问题本身是独立于特定上下文的，具有普遍性。
各区市县人民政府，广安经开区、枣山园区、协兴园区、华蓥山景区管委会，市级有关部门：为贯彻落实《四川省人民政府办公厅关于促进和规范健康医疗大数据应用发展的实施意见》（川办发〔2016〕98号）精神，规范和推动健康医疗大数据融合共享、开放应用，经市政府同意，现提出以下实施意见。一、工作目标到2017年底，全面建成市、县两级人口健康信息平台，实现省、市、县（区、市）三级人口健康信息平台互联互通，完成二级以上医疗机构居民健康卡用卡环境改造，普及应用居民健康卡，逐步实现跨机构、跨区域的健康信息、就诊信息共享,"《四川省人民政府办公厅关于促进和规范健康医疗大数据应用发展的实施意见》是由哪个机构发布的？
",《四川省人民政府办公厅关于促进和规范健康医疗大数据应用发展的实施意见》是由四川省人民政府办公厅发布的。,https://www.guang-an.gov.cn/gasrmzfw/c104243/pc/content/content_1743958013403901952.html,卫生、体育,广安市人民政府办公室关于促进和规范健康医疗大数据应用发展的实施意见,广安市人民政府办公室,5.0,上下文中明确提到了《四川省人民政府办公厅关于促进和规范健康医疗大数据应用发展的实施意见》（川办发〔2016〕98号），并且指明了这是由“四川省人民政府办公厅”发布的。因此，根据上下文内容，可以清楚、明确地回答问题。,2.0,这个问题对于普通公民理解政策文件的重要性相对较小。因为即使不知道具体是由哪个机构发布的，普通公民仍然可以了解到政策的主要内容和目的。政策文件的发布机构通常并不是理解政策内容的关键，而是政策的具体条款和实施措施才是普通公民需要关注的重点。,1.0,这个问题询问的是一个具体文件《四川省人民政府办公厅关于促进和规范健康医疗大数据应用发展的实施意见》的发布机构，这个文件名和其性质并没有在上下文中直接提及，需要预先知道这个文件的相关信息才能回答。因此，这个问题依赖于其他信息才能理解。
。加快建立市、县（区、市）卫生计生专业信息技术管理机构，培养引进熟悉医疗卫生和信息技术的复合型人才，着力提升专业化管理能力和水平，为健康医疗大数据应用发展提供支撑。鼓励政府与企事业单位、专业协会、社会机构开展合作，通过政府购买服务、委托专业公司管理、基层信息化实用人才培训等多种方式，建立一支具有健康医疗知识背景的高素质信息技术队伍，为健康医疗大数据安全高效的应用和发展提供技术保障。（责任部门：各区市县人民政府，广安经开区、枣山园区、协兴园区、华蓥山景区管委会，市卫生计生委、市中医管理局、市委编办、市人力资源社会保障局、市教育体育局、市科技和知识产权局、市经济和信息化委）（五）广泛宣传普及,"（市、县（区、市）卫生计生专业信息技术管理机构的建立目的是什么？）
",（建立市、县（区、市）卫生计生专业信息技术管理机构的目的是提升医疗卫生领域的专业化管理能力和水平，为健康医疗大数据应用发展提供支撑。）,https://www.guang-an.gov.cn/gasrmzfw/c104243/pc/content/content_1743958013403901952.html,卫生、体育,广安市人民政府办公室关于促进和规范健康医疗大数据应用发展的实施意见,广安市人民政府办公室,4.0,根据提供的上下文内容，问题关于市、县（区、市）卫生计生专业信息技术管理机构建立目的的答案是明确和具体的。上下文中详细说明了建立这样的机构是为了提升管理能力、培养复合型人才，并支撑健康医疗大数据的应用和发展，提供了建立机构的明确目标和意义。,4.0,这个问题对于普通公民来说非常有用，因为它涉及到公共卫生和信息技术管理，这些是现代社会中非常重要的领域。了解这些管理机构的目的可以帮助公民更好地理解他们所在地区的公共卫生政策和信息技术的发展方向。此外，这也有助于提高公民对政府工作的透明度和责任感的认识。,3.0,该问题直接询问的是特定机构（市、县（区、市）卫生计生专业信息技术管理机构）的建立目的，这个机构的专业领域对于不熟悉卫生计生领域的人来说可能不太清楚，所以这个问题在某种程度上依赖于对该领域的背景知识。然而，问题本身表述清晰，并且询问的是一个具体机构的明确目的，所以它具有一定的独立性。
。采取灵活多样、丰富多彩的形式加强健康医疗大数据应用发展政策宣传和解读，积极回应社会关切，形成良好社会氛围。积极引导医疗卫生机构和社会力量参与、举办形式多样的科普活动，宣传普及健康医疗大数据应用知识，鼓励开发应用简便易行的数字医学工具，不断提升人民群众掌握相关应用的能力和社会公众健康素养。（责任部门：市卫生计生委、市中医管理局、市文广新局、市政府新闻办）广安市人民政府办公室2017年2月22日相关附件：二维码开始扫一扫在手机打开当前页用来校验该浏览器是否支持HTML5,"什么是广安市加强健康医疗大数据应用发展的主要措施？
",广安市加强健康医疗大数据应用发展的主要措施包括：采取灵活多样、丰富多彩的形式加强健康医疗大数据应用发展政策宣传和解读，积极回应社会关切，形成良好社会氛围；积极引导医疗卫生机构和社会力量参与、举办形式多样的科普活动，宣传普及健康医疗大数据应用知识；鼓励开发应用简便易行的数字医学工具；不断提升人民群众掌握相关应用的能力和社会公众健康素养。,https://www.guang-an.gov.cn/gasrmzfw/c104243/pc/content/content_1743958013403901952.html,卫生、体育,广安市人民政府办公室关于促进和规范健康医疗大数据应用发展的实施意见,广安市人民政府办公室,4.0,根据提供的上下文，我们可以清楚了解到广安市为了加强健康医疗大数据应用发展所采取的具体措施。上下文明确提到了政策宣传、社会力量参与、科普活动举办以及开发数字医学工具等措施，这些措施旨在提升公众健康素养和掌握相关应用的能力。因此，问题可以在给定上下文的情况下清楚、明确地回答。,4.0,该问题针对的是广安市健康医疗大数据应用发展的主要措施，这对于普通公民了解当地健康医疗信息技术的发展、个人健康数据可能的应用以及如何更好地利用医疗资源非常关键。因此，这个问题对于关心健康医疗政策、想要了解如何通过大数据提高医疗服务质量的公民来说，具有较高的实用价值。,1.0,该问题涉及到特定城市广安市的健康医疗大数据应用发展的主要措施，这些信息没有在当前上下文中提供，因此需要额外的背景信息才能理解。
。到2020年，基本实现城乡居民拥有规范化的电子健康档案和功能完备的居民健康卡，基本建立适应市情的健康医疗大数据应用发展模式，初步形成健康医疗大数据产业体系，人民群众得到更多方便和实惠。二、工作重点（一）加快市、县（区、市）人口健康信息平台建设。2017年底前，全面建成市、县两级人口健康信息平台，逐步实现省、市、县三级人口健康信息平台资源互通共享。（责任部门：市卫生计生委、市中医管理局、市经济和信息化委）（二）推进居民健康卡发放和应用。优先发放贫困人口居民健康卡，完善贫困人口就医信息系统，实现贫困人口就医精准识别和诊疗信息动态管理,"何时要实现城乡居民拥有规范化的电子健康档案和功能完备的居民健康卡？
",到2020年，目标是实现城乡居民拥有规范化的电子健康档案和功能完备的居民健康卡。,https://www.guang-an.gov.cn/gasrmzfw/c104243/pc/content/content_1743958013403901952.html,卫生、体育,广安市人民政府办公室关于促进和规范健康医疗大数据应用发展的实施意见,广安市人民政府办公室,5.0,上下文提供了明确的时间节点，即到2020年基本实现该目标，因此可以根据上下文清楚、明确地回答问题。,4.0,这个问题涉及到城乡居民的电子健康档案和居民健康卡的实施时间，这对于普通公民了解自己能够获得规范化的健康服务的时间节点非常重要。这个问题有助于公民规划个人健康管理和使用相应的健康服务，因此对于关心自己健康和医疗服务的公民来说，这个问题非常有用。,2.0,这个问题询问了关于实施城乡居民电子健康档案和居民健康卡的具体时间，这些内容通常与国家的健康信息化政策、当前的健康卡实施阶段以及具体的地方政府规划有关。没有上下文信息，这个问题可能难以准确回答。
。重点拓展以妇幼、慢病、老年人等特殊群体为主的智能健康医疗服务应用，推广健康生活方式，全面提升公共卫生服务水平，促进全民预防保健体系建设。（责任部门：市卫生计生委、市中医管理局、市经济和信息化委）（五）积极推动智慧健康医疗便民惠民服务。探索互联网健康医疗服务模式，推动优质医疗资源共享，鼓励社会力量参与，整合线上线下资源，积极推进互联网健康咨询、网上预约分诊、在线问诊、移动支付和检查检验结果查询、随访跟踪等应用，积极探索高效快捷、共享开放、线上线下互信互动的医疗健康服务新模式。（责任部门：市卫生计生委、市中医管理局、市经济和信息化委、市科技和知识产权局）（六）促进关联产业发展,"（市卫生计生委、市中医管理局、市经济和信息化委）是哪些部门的责任？
",（市卫生计生委、市中医管理局、市经济和信息化委）负责重点拓展以妇幼、慢病、老年人等特殊群体为主的智能健康医疗服务应用，推广健康生活方式，全面提升公共卫生服务水平，促进全民预防保健体系建设，并积极推动智慧健康医疗便民惠民服务。,https://www.guang-an.gov.cn/gasrmzfw/c104243/pc/content/content_1743958013403901952.html,卫生、体育,广安市人民政府办公室关于促进和规范健康医疗大数据应用发展的实施意见,广安市人民政府办公室,5.0,上下文中明确提到了“（责任部门市卫生计生委、市中医管理局、市经济和信息化委）”，并且详细说明了这些部门在公共卫生服务水平提升、智慧健康医疗服务、以及互联网健康咨询服务等方面的职责。因此，根据上下文信息，可以明确回答这个问题。,4.0,这个问题对于普通公民来说非常有用。了解不同部门的职责和责任有助于公民更好地理解政府如何组织其工作，以及他们可以期待哪些部门处理特定问题。例如，市卫生计生委可能负责公共卫生和医疗服务，市中医管理局可能专注于中医药事务，而市经济和信息化委可能涉及经济发展和工业生产等方面。知晓这些部门的职能，公民可以更有效地寻求政府帮助，并提出针对性的建议或反馈。,2.0,该问题没有提供任何背景信息或上下文，因此无法确定这些部门的具体责任。这个问题对于了解具体情境的人来说可能很简单，但对于其他人来说则需要更多的信息。
