context,question,answer,source_url,category,title,org,groundedness_score,groundedness_eval,relevance_score,relevance_eval,standalone_score,standalone_eval
。如确需改变机构场所、设施用途或停业、歇业的，要提前三个月以书面形式告知当地民政部门。同时民政、财政部门应定期对享受一次性建设补贴的养老服务机构进行专项检查，对虚报冒领、骗取一次性建设补贴资金或已享受一次性建设补贴10年内改变经营性质的养老服务机构，要限期整改并追回全部补贴资金。享受运营补贴的养老服务机构与服务对象解除服务关系，运营补贴即行终止。四、加强组织领导管理（一）强化组织领导,"养老服务机构如果需要改变机构场所、设施用途或停业、歇业，应该提前多久通知当地民政部门？
",养老服务机构如果需要改变机构场所、设施用途或停业、歇业，应该提前三个月以书面形式告知当地民政部门。,https://www.guang-an.gov.cn/gasrmzfw/c104243/pc/content/content_1733365368811950080.html,民政、扶贫、救灾,广安市人民政府关于进一步加快发展养老服务业的实施意见,广安市人民政府办公室,5,上下文中明确指出，“如确需改变机构场所、设施用途或停业、歇业的，要提前三个月以书面形式告知当地民政部门。” 这句话提供了具体的时间要求和通知形式，因此可以根据上下文清楚、明确地回答问题。,4.0,这个问题对于普通公民理解养老服务机构的管理规定非常有用。它关系到服务机构变更对其客户（老年人）的服务质量和生活安排，同时也涉及民政部门如何管理这些服务机构，确保其符合政策和法规要求。此外，了解这样的规定可以帮助公民在选择养老服务机构时做出更明智的决策，以及在他们需要时采取适当的行动。,2.0,这个问题涉及到具体的法规或政策要求，这些要求对于理解养老服务机构的通知义务是必要的。没有这些信息，就无法确定通知的具体期限。
。对养老机构提供养老服务，减半征收有关行政事业性收费市财政局（牵头）、市发展改革委2014年4季度出台具体措施32养老机构用电、用水、用气，按居民生活类价格执行市发展改革委（牵头）和各区市县人民政府、园区管委会2014年4季度出台具体措施33境内外资本举办养老机构享有同等的税收优惠政策市财政局（牵头）、市发展改革委、市国税局、市地税局、市商务局、市民政局、市老龄办持续实施34加快建立养老服务评估机制，建立健全经济困难的高龄、失能等老年人补贴制度市财政局（牵头）、市民政局、市老龄办和各区市县人民政府、园区管委会2014年4季度出台具体措施35各级福利彩票公益金，要将50%以上的资金用于发展养老服,"哪些机构在提供养老服务时可以减半征收行政事业性收费？
",养老机构在提供养老服务时可以减半征收有关行政事业性收费。,https://www.guang-an.gov.cn/gasrmzfw/c104243/pc/content/content_1733365368811950080.html,民政、扶贫、救灾,广安市人民政府关于进一步加快发展养老服务业的实施意见,广安市人民政府办公室,5,根据上下文，明确提到的在提供养老服务时可以减半征收行政事业性收费的机构是“养老机构”。市财政局和市发展改革委牵头出台了具体措施，这说明这些机构在执行相关政策时能享受减半收费的优惠。,3.0,这个问题对于普通公民了解在提供养老服务时可能享受的优惠政策有一定用处，因为这可以帮助他们识别可以享受减税待遇的机构，从而在选择养老服务时做出更经济合理的决策。然而，这个问题对于理解政策文件的整体内容和深度有限，因为它只关注了减税机构这一具体点，而没有提供政策的全貌，比如减税的具体条件、执行的细节等。,2.0,这个问题涉及到具体的政策规定，需要了解当前的相关法律法规才能准确回答。这依赖于特定的上下文信息。
。按照实际收住老年人数对养老机构进行运营补贴，每人每月补贴标准不低于40元。对招用下岗失业人员并委托培训机构进行再就业岗前培训的养老机构给予培训补贴，按委托培训机构实际培训人数，每合格录用1名一次性给予补助不低于500元。3.落实城乡社区居家养老服务补贴。对乡镇（街道）、城乡社区新建、改建或租赁房屋，床位在10张以上的老年人居家养老服务中心（站）和社区日间照料中心，在该机构建成投入使用后5年内，按照每年不低于3000元标准给予服务补贴。4.建立财政分担机制,"每人每月养老机构运营补贴标准不低于多少元？
",每人每月养老机构运营补贴标准不低于40元。,https://www.guang-an.gov.cn/gasrmzfw/c104243/pc/content/content_1733365368811950080.html,民政、扶贫、救灾,广安市人民政府关于进一步加快发展养老服务业的实施意见,广安市人民政府办公室,5,根据上下文，明确提到了“每人每月补贴标准不低于40元”，这个信息是直接给出的，没有模糊性，因此可以清楚明确地回答问题。,4.0,该问题涉及到具体的政策补贴标准，对于普通公民来说，了解养老机构运营补贴的标准有助于他们更好地规划个人的养老安排，同时，这也是社会福利政策的一部分，与很多人的切身利益相关。因此，对于关心养老问题或需要了解养老机构运营情况的人来说，这个问题非常有用。,2.0,这个问题涉及到具体的政策或地方标准，这些标准可能会因地区而异，没有提供足够的上下文信息来确定具体的补贴标准。
。各地要加强养老服务业工作督查和绩效考核，确保工作责任落实。发改、民政和老龄工作机构要加强对本意见执行情况监督检查，对工作中的先进典型，要进行大力宣传，进一步营造养老服务业发展良好社会环境。附件：重点任务分工广安市人民政府2014年11月13日附件重点任务分工序号工  作  任  务负 责 单 位时间进度备注一、主要任务部分1各地在制订城市总体规划、控制性详细规划时，必须按照人均用地不少于0.1平方米的标准，分区分级规划设置养老服务设施,"各地在制订城市总体规划、控制性详细规划时，必须按照什么标准规划设置养老服务设施？
",各地在制订城市总体规划、控制性详细规划时，必须按照人均用地不少于0.1平方米的标准，分区分级规划设置养老服务设施。,https://www.guang-an.gov.cn/gasrmzfw/c104243/pc/content/content_1733365368811950080.html,民政、扶贫、救灾,广安市人民政府关于进一步加快发展养老服务业的实施意见,广安市人民政府办公室,5,上下文中明确提到了“各地在制订城市总体规划、控制性详细规划时，必须按照人均用地不少于0.1平方米的标准，分区分级规划设置养老服务设施”，这是一个具体的量化标准，因此可以根据上下文清楚、明确地回答问题。,4.0,这个问题对于普通公民理解政策文件非常有用。它关系到每个人可能关注的议题——老龄化社会中的养老服务。了解政策如何指导城市规划，包括养老服务设施的设置，可以帮助公民更好地参与到社区建设和养老服务的改善中去。此外，对于那些可能直接或间接参与到养老服务设施建设和管理的人来说，这样的信息更为关键。因此，该问题提供了关于公共服务设施如何根据标准规划的洞见，对普通公民理解和支持相关政策具有实际意义。,5.0,这个问题询问了在制订城市总体规划和控制性详细规划时，养老服务设施设置的标准。这个问题的内容是独立于特定上下文的，是一个普遍性的问题，适用于各种城市规划的背景。所询问的答案可以在通用的城市规划法规、标准或政策文件中找到，不依赖于特定的地区或情境。
