context,question,answer,source_url,category,title,org,groundedness_score,groundedness_eval,relevance_score,relevance_eval,standalone_score,standalone_eval
广安市人民政府关于调整全市最低工资标准的通知,"广安市最近一次调整最低工资标准是什么时候？
",广安市最近一次调整最低工资标准的具体时间未在提供的上下文中说明。,https://www.guang-an.gov.cn/gasrmzfw/c104243/pc/content/content_1733373932666359808.html,劳动、人事、监察,广安市人民政府关于调整全市最低工资标准的通知,广安市人民政府办公室,2,要回答这个问题，需要查阅广安市最近的通知或政策文件，这可能包括对最低工资标准的调整。由于我无法直接访问最新的信息，所以无法提供确切的日期。,4,这个问题对于普通公民了解广安市的经济发展水平和劳动市场状况非常有用。最低工资标准的调整直接影响到低收入群体的收入水平和生活质量，也反映了政府对低收入人群的关怀程度和经济政策的导向。此外，对于求职者、雇主以及从事劳动关系管理的人员来说，掌握最新的最低工资标准信息是必要的。,5,这个问题询问的是广安市的最低工资标准调整时间，它直接涉及特定地区的当前政策信息，并且不依赖于其他信息即可理解其意义。
。以上标准包含个人应缴纳的社会保险费和住房公积金。但不包括下列各项：加班加点工资；中班、夜班、高温、低温、井下、有毒有害等特殊工作条件或者特殊工作环境下的津贴；法律、法规、规章、政策规定的非工资性劳动保险福利待遇；用人单位支付给劳动者的非货币性补贴。用人单位有条件为劳动者提供食宿的，在此支出之外支付给劳动者的工资也不能低于当地最低工资标准。各县（市、区）、广安经开区和川渝高竹新区人力资源社会保障部门要加强劳动保障监察执法，确保最低工资标准落到实处，切实维护劳动者的合法权益。本通知自2022年8月1日起施行，有效期3年。2022年4月1日至本通知施行之日期间的最低工资标准，按照本通知执行,"什么是不得低于当地最低工资标准的项目？
",不得低于当地最低工资标准的项目包括加班加点工资；中班、夜班、高温、低温、井下、有毒有害等特殊工作条件或者特殊工作环境下的津贴；法律、法规、规章、政策规定的非工资性劳动保险福利待遇；用人单位支付给劳动者的非货币性补贴。,https://www.guang-an.gov.cn/gasrmzfw/c104243/pc/content/content_1733373932666359808.html,劳动、人事、监察,广安市人民政府关于调整全市最低工资标准的通知,广安市人民政府办公室,4,根据上下文内容，问题询问的是关于不得低于当地最低工资标准的项目。上下文提到了工资的组成成分，包括社会保险费和住房公积金，并指出在扣除这些费用后，支付给劳动者的工资仍不得低于当地最低工资标准。此外，上下文还提到了一些不被包括在工资内的项目，例如加班工资、特殊工作条件的津贴、非工资性劳动保险福利待遇和非货币性补贴等。最后，还提到了确保最低工资标准实施的监察执法措施和执行时间。根据这些信息，可以明确回答问题不得低于当地最低工资标准的项目是指扣除社会保险费和住房公积金后支付给劳动者的工资。,5,这个问题对于普通公民理解政策文件非常有用，因为它关系到每个人的合法权益。了解哪些项目不得低于当地最低工资标准，有助于公民保障自己的劳动报酬，认识并监督用人单位是否遵守相关法律法规。同时，这也是对劳动法和社会公平正义的一种体现。,5,这个问题询问的是“不得低于当地最低工资标准的项目”，这个概念在劳动法或相关的劳动标准中可以找到。它不依赖于特定的上下文信息，而是询问一个明确的法律或政策规定。因此，这个问题可以独立存在，具有明确的意义。
。2018年9月13日发布的《广安市人民政府关于调整全市最低工资标准的通知》（广安府函〔2018〕99号）同时废止。广安市人民政府2022年7月29日相关附件：广安府规〔2022〕5号关于调整全市最低工资标准的通知.pdf(/gasrmzfw/c104243/1733373932666359808/HItkfMYy.pdf)二维码开始扫一扫在手机打开当前页用来校验该浏览器是否支持HTML5,"广安市在2022年调整最低工资标准的文件是什么？
",广安市在2022年调整最低工资标准的文件是《广安府规〔2022〕5号关于调整全市最低工资标准的通知》。,https://www.guang-an.gov.cn/gasrmzfw/c104243/pc/content/content_1733373932666359808.html,劳动、人事、监察,广安市人民政府关于调整全市最低工资标准的通知,广安市人民政府办公室,5,根据提供的上下文，有一个明确的文件号码和文件标题与问题相关。这个信息直接回答了询问的文件名称，因此易于获取且明确。,4,这个问题对于普通公民理解政策文件有用，因为它关系到每个人的收入水平，直接影响到人们的生活质量。广安市调整最低工资标准是一个重要的社会经济政策，普通公民了解这一政策文件的内容可以帮助他们维护自身合法权益，同时也有助于提高社会公平正义。,1,该问题询问的是广安市在2022年调整最低工资标准的具体文件，这需要对该地的劳动政策有一定的了解才能回答。这个问题依赖于具体的时间、地点和政策信息，因此不是独立的。
